research_field,topic_words,topic_label
Aerospace Medicine,"microgravity, bone, muscle, radiation, countermeasure",Spaceflight Physiology and Risk
Aerospace Medicine,"hypoxia, decompression, barotrauma, altitude, cabin",High-Altitude Environments & Hazards
Aerospace Medicine,"vestibular, orientation, disorientation, motion, simulator",Spatial Orientation and Motion Sickness
Aerospace Medicine,"fatigue, sleep, circadian, performance, alertness",Crew Fatigue and Human Factors
Aerospace Medicine,"telemedicine, remote, monitoring, diagnosis, health",Remote Medical Care in Space
Aerospace Medicine,"selection, training, fitness, standards, psychological",Pilot and Astronaut Fitness
Aerospace Medicine,"g-force, acceleration, tolerance, ejection, impact",Aerodynamic Stress and Tolerance
Anesthesiology,"pain, opioids, regional, analgesia, chronic",Chronic Pain Management
Anesthesiology,"induction, airway, intubation, ventilation, monitoring",General Anesthesia Techniques
Anesthesiology,"perioperative, outcomes, risk, mortality, recovery",Perioperative Patient Safety
Anesthesiology,"block, neuraxial, epidural, spinal, local",Regional Anesthesia and Blocks
Anesthesiology,"hemodynamics, cardiovascular, cardiac, hypotension, circulation",Anesthetic Cardiovascular Effects
Anesthesiology,"pediatric, neonatal, developmental, airway, children",Pediatric Anesthesia Challenges
Anesthesiology,"drug, pharmacokinetics, pharmacodynamics, delivery, toxicity",Anesthetic Drug Pharmacology
Behavioral Medicine,"adherence, self-management, lifestyle, prevention, intervention",Behavior Change Interventions
Behavioral Medicine,"stress, cortisol, hpa, immune, inflammation",Psychoneuroimmunology and Stress
Behavioral Medicine,"emotion, regulation, affect, coping, health",Emotion and Health
Behavioral Medicine,"sleep, circadian, insomnia, rest, disorder",Sleep and Behavioral Health
Behavioral Medicine,"smoking, alcohol, obesity, substance, addiction",Health Risk Behaviors
Behavioral Medicine,"relationship, social, support, isolation, network",Social Support and Health
Behavioral Medicine,"pain, chronic, management, perception, biofeedback",Chronic Pain Management
Cardiology,"myocardial, infarction, ischemia, reperfusion, stent",Acute Coronary Syndromes
Cardiology,"hypertension, blood, pressure, regulation, vascular",Hypertension and Vascular Biology
Cardiology,"atrial, fibrillation, arrhythmia, ablation, pacemaker",Cardiac Rhythm Disorders
Cardiology,"echocardiography, imaging, mri, ct, angiography",Cardiovascular Imaging Techniques
Cardiology,"ventricular, ejection, fraction, failure, remodeling",Heart Failure Mechanisms
Cardiology,"cholesterol, lipids, atherosclerosis, plaque, statin",Atherosclerosis and Dyslipidemia
Cardiology,"valve, aortic, mitral, repair, replacement",Valvular Heart Disease
Critical Care,"sepsis, shock, vasopressors, antibiotics, resuscitation",Sepsis and Septic Shock Management
Critical Care,"ventilator, intubation, ards, oxygenation, mechanical",Mechanical Ventilation Strategies
Critical Care,"delirium, sedation, analgesia, mobility, bundle","Pain, Agitation, Delirium Management"
Critical Care,"renal, failure, dialysis, crrt, kidney",Acute Kidney Injury & RRT
Critical Care,"monitoring, hemodynamics, catheter, cardiac, output",Advanced Hemodynamic Monitoring
Critical Care,"outcomes, survivors, pics, rehabilitation, functional",Post-ICU Syndrome Outcomes
Critical Care,"nutrition, enteral, parenteral, feeding, metabolism",Critical Care Nutrition
Dermatology,"melanoma, nevus, lesion, pigmented, cancer",Melanoma and Pigmented Lesions
Dermatology,"psoriasis, eczema, dermatitis, inflammation, autoimmune",Inflammatory Skin Diseases
Dermatology,"laser, aesthetic, cosmetic, resurfacing, fillers",Laser and Aesthetic Dermatology
Dermatology,"biopsy, histopathology, epidermis, dermis, acanthosis",Dermatopathology and Tissue Analysis
Dermatology,"mohs, surgery, oncology, carcinoma, excision",Dermatologic Surgery and Oncology
Dermatology,"atopic, contact, patch, allergy, irritant",Contact and Atopic Dermatitis
Dermatology,"pediatric, birthmark, genetic, infant, development",Pediatric Dermatology Conditions
Geriatrics,"frailty, sarcopenia, nutrition, exercise, weakness",Frailty and Sarcopenia Research
Geriatrics,"dementia, alzheimer's, cognition, neurodegeneration, impairment",Cognitive Decline and Dementia
Geriatrics,"multimorbidity, polypharmacy, comorbidity, complexity, management",Complex Chronic Conditions
Geriatrics,"falls, balance, gait, prevention, mobility",Falls Prevention and Mobility
Geriatrics,"palliative, end-of-life, care, comfort, quality",Palliative and End-of-Life Care
Geriatrics,"aging, senescence, cellular, biological, longevity",Biological Mechanisms of Aging
Geriatrics,"rehabilitation, functional, recovery, therapy, independence",Geriatric Rehabilitation Outcomes
Hematology,"anemia, erythrocytes, hemoglobin, iron, deficiency",Red Cell Disorders (Anemia)
Hematology,"leukemia, lymphoma, myeloma, malignancy, oncology",Hematologic Malignancies/Cancers
Hematology,"coagulation, platelets, thrombosis, bleeding, hemostasis",Coagulation and Clotting Disorders
Hematology,"bone, marrow, transplant, stem, allogeneic",Stem Cell and Marrow Transplant
Hematology,"immunotherapy, car-t, t-cells, immune, modulation",Immunotherapy in Hematology
Hematology,"hemoglobinopathies, sickle, thalassemia, genetic, variants",Genetic Blood Disorders
Hematology,"blood, transfusion, compatibility, products, apheresis",Transfusion Medicine
Hepatology,"cirrhosis, fibrosis, portal, hypertension, decompensation",Chronic Liver Disease Progression
Hepatology,"hepatitis, b, c, viral, antiviral",Viral Hepatitis Treatment
Hepatology,"nash, fatty, steatosis, mafld, metabolic",Non-Alcoholic Fatty Liver
Hepatology,"transplantation, rejection, alloimmunity, graft, immunosuppression",Liver Transplant Immunology
Hepatology,"carcinoma, hcc, tumor, chemotherapy, ablation",Hepatocellular Carcinoma Management
Hepatology,"injury, failure, acute, toxicity, drug",Acute Liver Injury
Hepatology,"biliary, cholangiopathy, ducts, cholestasis, pbc",Biliary Disorders
Infectious Disease,"resistance, antibiotic, bacteria, stewardship, drug",Antimicrobial Resistance & Stewardship
Infectious Disease,"vaccine, development, immunology, trials, antivirals",Antiviral and Vaccine Research
Infectious Disease,"microbial, pathogenesis, host, infection, virulence",Microbial Pathogenesis & Virulence
Infectious Disease,"vector, mosquito, tick, zoonotic, transmission",Vector-borne and Zoonotic Diseases
Infectious Disease,"hiv, aids, retrovirus, prevention, therapy",HIV/AIDS Research and Treatment
Infectious Disease,"epidemics, outbreak, modeling, surveillance, public",Infectious Disease Epidemiology
Infectious Disease,"hospital, nosocomial, healthcare, prevention, control",Healthcare-Associated Infection Control
Laboratory Medicine,"blood, cells, count, platelets, hematology",Complete Blood Count Analysis
Laboratory Medicine,"chemical, fluid, analyte, clinical, biochemistry",Clinical Chemistry Testing
Laboratory Medicine,"pathogen, culture, antibiotic, sensitivity, bacteriology",Clinical Microbiology and Infectious Disease
Laboratory Medicine,"tissue, pathology, biopsy, staining, histology",Histopathology and Tissue Analysis
Laboratory Medicine,"antigen, antibody, serology, immune, assay",Immunology and Serological Assays
Laboratory Medicine,"dna, rna, pcr, sequencing, molecular",Molecular Diagnostics Techniques
Laboratory Medicine,"coagulation, plasma, thrombosis, hemostasis, testing",Coagulation and Hemostasis Studies
Nephrology,"chronic, failure, disease, esrd, progression",Chronic Kidney Disease Progression
Nephrology,"dialysis, hemodialysis, peritoneal, filtration, treatment",Renal Replacement Therapy
Nephrology,"glomerulonephritis, glomerular, inflammation, biopsy, nephritis",
Nephrology,"transplant, rejection, immunosuppression, donor, allograft",Kidney Transplantation Research
Nephrology,"acute, injury, aki, ischemia, sepsis",Acute Kidney Injury
Nephrology,"hypertension, blood, pressure, cardiorenal, electrolytes",Hypertension and Kidney Function
Nephrology,"polycystic, genetic, pkd, cysts, inherited",Polycystic Kidney Disease
Neurology,"dementia, amyloid, tau, neurodegeneration, biomarker",Neurodegenerative Disease Research
Neurology,"seizure, epilepsy, eeg, antiepileptic, status",Epilepsy and Seizure Disorders
Neurology,"stroke, ischemic, hemorrhagic, thrombolysis, neurovascular",Cerebrovascular Disease Treatment
Neurology,"movement, parkinson, tremor, dopamine, deep",Movement Disorders and DBS
Neurology,"sclerosis, autoimmune, myelin, inflammation, neuroimmunology",Multiple Sclerosis and Neuroimmunology
Neurology,"nerve, muscle, neuropathy, electromyography, junction",Neuromuscular Disorders Diagnostics
Neurology,"brain, spinal, tumor, glioma, oncology",Neuro-Oncology and Brain Tumors
Obstetrics and Gynecology,"preeclampsia, hypertension, prediction, maternal, neonatal",Preeclampsia Management and Outcomes
Obstetrics and Gynecology,"contraception, counseling, family, planning, abortion",Reproductive Health and Family Planning
Obstetrics and Gynecology,"cancer, ovarian, cervical, oncology, hpv",Gynecologic Oncology Research
Obstetrics and Gynecology,"cesarean, section, incision, delivery, outcomes",Cesarean Section Optimization
Obstetrics and Gynecology,"fetus, monitoring, ultrasound, pregnancy, complications",Fetal Health and Monitoring
Obstetrics and Gynecology,"menopause, hormone, therapy, perimenopause, aging",Menopause and Hormone Therapy
Obstetrics and Gynecology,"disorder, substance, maternal, pregnancy, treatment",Maternal Substance Use Disorders
Oncology,"immunotherapy, checkpoint, pd1, ctla4, response",Cancer Immunotherapy Mechanisms
Oncology,"tumor, microenvironment, stroma, angiogenesis, fibroblast",Tumor Microenvironment Research
Oncology,"radiation, dosimetry, fractionation, toxicity, proton",Radiation Oncology Treatment
Oncology,"chemotherapy, drug, resistance, agent, combination",Chemotherapy and Drug Resistance
Oncology,"biomarker, diagnosis, prognosis, molecular, liquid",Cancer Biomarkers and Diagnostics
Oncology,"metastasis, invasion, dissemination, recurrence, progression",Cancer Metastasis and Progression
Oncology,"imaging, mri, pet, ct, radiomics",Oncological Imaging and Radiomics
Ophthalmology,"retina, degeneration, macular, vision, photoreceptor",Retinal Degeneration and Macula
Ophthalmology,"intraocular, pressure, optic, nerve, filtration",Glaucoma and Ocular Pressure
Ophthalmology,"cornea, refractive, surgery, laser, ablation",Corneal and Refractive Surgery
Ophthalmology,"cataract, lens, phacoemulsification, intraocular, implantation",Cataract and Lens Surgery
Ophthalmology,"inflammation, uveitis, autoimmune, retinitis, corticosteroid",Inflammatory Eye Diseases
Ophthalmology,"diabetic, angiogenesis, edema, retinopathy, vascular",Diabetic Eye Disease Research
Ophthalmology,"pediatric, strabismus, amblyopia, retinopathy, ophthalmoscopy",Pediatric Eye Disorders
Orthopedics,"arthroplasty, replacement, hip, knee, joint",Joint Replacement Surgery
Orthopedics,"fracture, trauma, fixation, bone, nonunion",Orthopedic Trauma and Repair
Orthopedics,"ligament, acl, tear, sports, rehabilitation",Sports Medicine Injuries
Orthopedics,"spine, fusion, scoliosis, stenosis, disc",Spinal Surgery and Conditions
Orthopedics,"cartilage, regeneration, stem, cell, biomaterials",Musculoskeletal Regeneration Research
Orthopedics,"arthroscopy, minimally, invasive, camera, procedure",Minimally Invasive Arthroscopy
Orthopedics,"pediatric, congenital, deformity, growth, skeletal",Pediatric Orthopedic Issues
Osteopathic Medicine and Osteopathy,"manipulation, treatment, omt, techniques, efficacy",Osteopathic Manipulative Treatment
Osteopathic Medicine and Osteopathy,"musculoskeletal, pain, joints, somatic, dysfunction",Musculoskeletal Pain and Dysfunction
Osteopathic Medicine and Osteopathy,"whole, person, holistic, philosophy, healthcare",Holistic Osteopathic Philosophy
Osteopathic Medicine and Osteopathy,"craniosacral, fluid, rhythm, cranial, tension",Craniosacral Therapy Techniques
Osteopathic Medicine and Osteopathy,"fascia, myofascial, release, tissue, connective",Myofascial Release Techniques
Osteopathic Medicine and Osteopathy,"muscle, energy, technique, counterstrain, positional",Muscle Energy Techniques
Osteopathic Medicine and Osteopathy,"pediatrics, infants, children, development, pregnancy",Pediatric Osteopathic Care
Otolaryngology,"sensorineural, conductive, tinnitus, audiology, amplification",Hearing Loss and Tinnitus
Otolaryngology,"sinusitis, rhinoplasty, endoscopic, obstruction, polyps",Rhinology and Sinus Surgery
Otolaryngology,"laryngeal, vocal, swallowing, dysphonia, tracheostomy",Laryngology and Voice Disorders
Otolaryngology,"balance, vertigo, vestibular, dizziness, meniere",Vestibular and Balance Disorders
Otolaryngology,"parotid, thyroid, neck, cancer, reconstruction",Head and Neck Oncology
Otolaryngology,"eardrum, otosclerosis, ossicular, otitis, tympanoplasty",Otology and Middle Ear
Otolaryngology,"airway, tonsillitis, apnea, pediatric, adenoids",Pediatric Otolaryngology
Pathology,"biopsy, histology, microscopy, diagnosis, tissue",Histopathology and Tissue Diagnosis
Pathology,"cellular, morphology, cytoplasm, nucleus, atypia",Cellular Pathology and Analysis
Pathology,"cancer, neoplasm, malignancy, oncology, tumors",Oncologic and Neoplastic Pathology
Pathology,"inflammation, infection, immune, response, disease",Inflammatory Disease Mechanisms
Pathology,"blood, hematopoiesis, coagulation, anemia, leukemia",Hematology and Blood Disorders
Pathology,"autopsy, forensic, death, cause, medical-legal",Autopsy and Forensic Pathology
Pathology,"molecular, genetics, mutation, biomarker, sequencing",Molecular Pathology and Genetics
Pediatrics,"neonatal, perinatal, preterm, nicu, newborn",Neonatal-Perinatal Medicine
Pediatrics,"child, behavioral, development, disorders, assessment",Developmental and Behavioral Pediatrics
Pediatrics,"vaccine, immunization, infectious, prevention, epidemiology",Infectious Disease and Vaccines
Pediatrics,"cardiology, congenital, heart, echo, defects",Pediatric Cardiology
Pediatrics,"asthma, pulmonary, respiratory, sleep, allergy",Pulmonology and Sleep Medicine
Pediatrics,"adolescent, health, risk, mental, transition",Adolescent Health and Medicine
Pediatrics,"critical, intensive, emergency, care, resuscitation",Pediatric Critical Care
Preventive Medicine,"immunization, vaccine, uptake, coverage, hesitancy",Public Health Immunization Strategies
Preventive Medicine,"screening, early, detection, cancer, guidelines",Clinical Preventive Screening
Preventive Medicine,"epidemiology, incidence, prevalence, risk, population",Disease Risk Epidemiology
Preventive Medicine,"smoking, cessation, tobacco, intervention, nicotine",Tobacco Cessation Programs
Preventive Medicine,"diet, exercise, obesity, lifestyle, promotion",Health Behavior Promotion
Preventive Medicine,"policy, health, legislation, community, evaluation",Preventive Health Policy
Preventive Medicine,"hypertension, cholesterol, diabetes, management, primary",Chronic Disease Prevention
Primary Care,"prevention, screening, vaccination, counseling, health",Preventive Care and Screening
Primary Care,"hypertension, diabetes, management, chronic, disease",Chronic Disease Management
Primary Care,"access, health, underserved, equity, community",Healthcare Access and Equity
Primary Care,"behavioral, depression, anxiety, screening, integration",Integrated Behavioral Health
Primary Care,"patient, centered, shared, decision, relationship",Patient-Centered Care
Primary Care,"telehealth, virtual, digital, remote, technology",Telehealth and Digital Health
Primary Care,"diagnosis, symptoms, undifferentiated, acute, triage",Acute Symptom Diagnosis
Psychiatry,"dopamine, serotonin, neurotransmitter, receptors, brain",Neurotransmitter Systems and Brain
Psychiatry,"schizophrenia, psychosis, hallucinations, delusions, antipsychotics",Psychosis and Schizophrenia Treatment
Psychiatry,"depression, mood, suicide, bipolar, antidepressants",Mood Disorders and Treatment
Psychiatry,"trauma, stress, ptsd, coping, events",Trauma and Stress Disorders
Psychiatry,"cognition, behavioral, therapy, cbt, mindfulness",Cognitive Behavioral Therapy
Psychiatry,"adolescent, child, adhd, developmental, pediatric",Child and Adolescent Psychiatry
Psychiatry,"addiction, substance, abuse, opioid, craving",Addiction and Substance Abuse
Pulmonology,"copd, emphysema, airflow, chronic, spirometry",Chronic Obstructive Pulmonary Disease
Pulmonology,"asthma, airway, inflammation, bronchial, inhaler",Asthma Management and Pathophysiology
Pulmonology,"fibrosis, interstitial, scarring, diffuse, idiopathic",Interstitial Lung Disease
Pulmonology,"embolism, pulmonary, thrombus, hypertension, arterial",Pulmonary Vascular Disease
Pulmonology,"pneumonia, infection, community, bacterial, acute",Acute Respiratory Infections
Pulmonology,"ventilation, mechanical, ards, respiratory, failure",Mechanical Ventilation and ARDS
Pulmonology,"bronchoscopy, biopsy, interventional, endoscopy, lung",Interventional Pulmonology Techniques
Radiation Medicine,"treatment, delivery, planning, accuracy, imaging",Radiation Treatment Planning & Delivery
Radiation Medicine,"dna, damage, repair, cell, response",Cellular Radiobiology
Radiation Medicine,"external, beam, photons, protons, therapy",External Beam Radiation Therapy
Radiation Medicine,"brachytherapy, internal, implant, dose, source",Internal Radiation Therapy (Brachytherapy)
Radiation Medicine,"dosimetry, physics, target, organ, protection",Medical Physics and Dosimetry
Radiation Medicine,"biomarkers, patient, personalized, outcome, prognosis",Personalized Radiation Oncology
Radiation Medicine,"immunotherapy, combination, modulation, system, cancer",Immuno-oncology Combination Therapy
Rheumatology,"autoimmunity, cytokines, inflammation, t-cells, b-cells",Immunopathogenesis of Rheumatic Diseases
Rheumatology,"synovitis, cartilage, bone, erosion, joint",Rheumatoid Arthritis Pathophysiology
Rheumatology,"lupus, nephritis, antibodies, malar, systemic",Systemic Lupus Erythematosus Research
Rheumatology,"biologics, dmards, methotrexate, treatment, therapy",Pharmacological Treatment Strategies
Rheumatology,"ultrasound, mri, imaging, diagnosis, assessment",Musculoskeletal Imaging in Rheumatology
Rheumatology,"uric, crystals, hyperuricemia, tophi, allopurinol",Gout and Crystal Arthropathies
Rheumatology,"fibromyalgia, pain, chronic, tender, fatigue",Chronic Pain Syndromes
Sleep Medicine,"apnea, obstructive, breathing, snoring, airway",Obstructive Sleep Apnea
Sleep Medicine,"insomnia, cbti, behavioral, cognitive, therapy",Insomnia and CBT-I
Sleep Medicine,"rhythm, circadian, entrainment, clock, light",Circadian Rhythm Disorders
Sleep Medicine,"rem, non-rem, stages, cycles, architecture",Sleep Stages and Architecture
Sleep Medicine,"hypersomnia, narcolepsy, excessive, sleepiness, cataplexy",Central Hypersomnia Disorders
Sleep Medicine,"restless, periodic, movement, legs, disorders",Sleep Related Movement Disorders
Sleep Medicine,"polysomnography, eeg, monitoring, study, diagnosis",Sleep Study Diagnostics
Surgery,"robotics, minimally, invasive, teleoperation, laparoscopic",Robotic and Minimally Invasive Surgery
Surgery,"anesthesia, pain, perioperative, recovery, management",Perioperative Pain Management
Surgery,"training, simulation, education, resident, skill",Surgical Training and Simulation
Surgery,"transplant, organ, rejection, donor, recipient",Organ Transplant Surgery
Surgery,"hemostasis, bleeding, coagulation, irrigation, wound",Surgical Hemostasis Techniques
Surgery,"imaging, guidance, navigation, fluorescence, intraoperative",Image-Guided Surgery
Surgery,"oncology, tumor, resection, margins, metastasis",Surgical Oncology Procedures
Urology,"prostate, cancer, biopsy, risk, treatment",Prostate Cancer Management
Urology,"kidney, stones, calculi, lithotripsy, ureteroscopy",Urinary Stone Disease
Urology,"bladder, incontinence, pelvic, female, reconstruction",Female Urology & Reconstruction
Urology,"erectile, dysfunction, infertility, andrology, testosterone",Male Sexual Health
Urology,"robotics, laparoscopy, minimally, surgery, nephrectomy",Minimally Invasive Urologic Surgery
Urology,"pediatric, hypospadias, vesicoureteral, reflux, cryptorchidism",Pediatric Urology Conditions
Urology,"neurogenic, bladder, spinal, catheterization, dysfunction",Neurourology and Dysfunction
Other Medical Specialties,"palliative, hospice, symptom, care, quality",Palliative and Hospice Care
Other Medical Specialties,"sleep, apnea, insomnia, circadian, disorders",Sleep Medicine Research
Other Medical Specialties,"sports, injuries, rehabilitation, performance, musculoskeletal",Sports Medicine
Other Medical Specialties,"addiction, substance, abuse, treatment, disorders",Addiction Medicine
Other Medical Specialties,"geriatric, aging, frailty, elderly, medicine",Geriatric Medicine
Other Medical Specialties,"pain, chronic, relief, management, neuropathic",Chronic Pain Management
Other Medical Specialties,"medical, toxicology, poisoning, drugs, exposure",Medical Toxicology
Animal-Assisted Therapy,"physiological, stress, cortisol, oxytocin, heart",Physiological Effects of AAT
Animal-Assisted Therapy,"mental, health, depression, anxiety, ptsd",AAT in Mental Health
Animal-Assisted Therapy,"intervention, program, protocol, efficacy, outcomes",AAT Program Evaluation
Animal-Assisted Therapy,"child, autism, social, interaction, development",AAT for Childhood Disorders
Animal-Assisted Therapy,"animal, welfare, ethics, training, handler",Animal Welfare and Ethics
Animal-Assisted Therapy,"geriatric, dementia, nursing, residents, quality",AAT in Geriatric Care
Animal-Assisted Therapy,"dog, cat, horse, equine, species",Diverse Animal Species in AAT
Art Therapy,"efficacy, outcome, intervention, measurement, results",Efficacy and Outcome Research
Art Therapy,"trauma, informed, safety, stabilization, resilience",Trauma-Informed Art Therapy
Art Therapy,"neuroscience, brain, neurobiological, imaging, mechanism",Art Therapy and Neuroscience
Art Therapy,"digital, virtual, technology, telehealth, remote",Digital and Remote Art Therapy
Art Therapy,"assessment, validity, reliability, evaluation, standardization",Assessment and Reliability
Art Therapy,"cultural, multicultural, diversity, ethnic, cross-cultural",Multicultural Art Therapy Practice
Art Therapy,"youth, schools, adolescents, children, prevention",School-Based Art Therapy
Community Health,"prevention, promotion, education, intervention, programs",Health Promotion and Prevention
Community Health,"disparities, equity, social, determinants, vulnerable",Social Determinants of Health
Community Health,"assessment, needs, data, epidemiology, surveillance",Community Health Assessment
Community Health,"primary, access, care, rural, services",Primary Healthcare Access
Community Health,"infectious, disease, communicable, outbreak, control",Infectious Disease Control
Community Health,"obesity, nutrition, physical, activity, lifestyle",Chronic Disease Prevention
Community Health,"mental, stigma, support, wellbeing, counseling",Mental Health Services
Psychoanalysis and Psychotherapy,"unconscious, id, ego, superego, drives",Freudian Structural Theory
Psychoanalysis and Psychotherapy,"transference, countertransference, relationship, therapeutic, setting",Therapeutic Relationship Dynamics
Psychoanalysis and Psychotherapy,"defense, mechanisms, repression, denial, projection",Psychological Defense Mechanisms
Psychoanalysis and Psychotherapy,"object, relations, internalization, attachment, interpersonal",Object Relations Theory
Psychoanalysis and Psychotherapy,"dream, interpretation, symbols, latent, manifest",Dream Analysis and Meaning
Psychoanalysis and Psychotherapy,"self, cohesion, mirroring, idealizing, empathy",Self Psychology Concepts
Psychoanalysis and Psychotherapy,"psychodynamic, brief, time-limited, efficacy, outcome",Psychodynamic Psychotherapy Research
Substance Abuse and Addiction,"dopamine, reward, neurobiology, craving, tolerance",Neurobiology of Addiction
Substance Abuse and Addiction,"opioid, naloxone, methadone, buprenorphine, receptors",Opioid Use Disorder Treatment
Substance Abuse and Addiction,"cbt, therapy, relapse, prevention, counseling",Behavioral Interventions in Addiction
Substance Abuse and Addiction,"adolescent, vulnerability, prevention, risk, peer",Adolescent Substance Use
Substance Abuse and Addiction,"comorbidity, mental, health, dual, diagnosis",Co-occurring Disorders
Substance Abuse and Addiction,"genetic, heritability, epigenetics, polymorphism, risk",Genetics of Substance Abuse
Substance Abuse and Addiction,"screening, brief, intervention, referral, treatment",Symptom Assessment and Referral
Other Mental and Social Health,"stigma, help-seeking, access, community, barriers",Mental Health Service Barriers
Other Mental and Social Health,"social, media, digital, wellness, intervention",Digital Mental Health and Wellness
Other Mental and Social Health,"refugee, trauma, migration, resilience, acculturation",Refugee Mental Health and Trauma
Other Mental and Social Health,"workplace, burnout, stress, support, occupation",Occupational Mental Health
Other Mental and Social Health,"lgbtq+, minority, stress, identity, disparities",LGBTQ+ Mental Health Disparities
Other Mental and Social Health,"youth, adolescent, school, prevention, emotional",Youth and School Mental Health
Other Mental and Social Health,"homelessness, poverty, housing, vulnerability, inequality",Socioeconomic Factors in Mental Health
Nanomedicine,"drug, delivery, targeted, nanoparticle, therapy",Targeted Nanoparticle Drug Delivery
Nanomedicine,"biosensors, detection, imaging, molecular, diagnostic",Nano-Biosensors for Diagnostics
Nanomedicine,"toxicity, biocompatibility, safety, in-vitro, assessment",Nanomaterial Safety and Toxicity
