research_field,topic_words,topic_label
Cultural History,"memory, trauma, commemoration, archive, oral",Cultural Memory and Trauma
Cultural History,"gender, sexuality, performance, identity, body",Gender and Sexuality History
Cultural History,"print, reading, literacy, circulate, public",History of Print Culture
Cultural History,"emotion, feeling, affective, regimes, experiences",History of Emotions
Cultural History,"visual, representation, image, media, spectacle",Visual Culture Studies
Cultural History,"religion, ritual, belief, secularization, sacred",Cultural History of Religion
Liturgy and Worship,"eucharist, communion, sacrament, table, celebration",Eucharistic Liturgy and Practice
Liturgy and Worship,"baptism, initiation, sacrament, rite, water",The Sacrament of Baptism
Liturgy and Worship,"chant, music, hymnody, song, singing",Worship Music and Hymnody
Liturgy and Worship,"architecture, space, design, ritual, setting",Liturgical Space and Architecture
Liturgy and Worship,"prayer, lectionary, readings, office, daily",Daily Office and Set Prayer
Liturgy and Worship,"sermon, homily, preaching, scripture, proclamation",Sermon and Biblical Proclamation
Liturgy and Worship,"ritual, posture, movement, gestures, embodiment",Ritual Movement and Embodiment
Yiddish Language and Literature,"yiddish, germanic, hebrew, ashkenaz, linguistics",Yiddish Linguistic Origins
Yiddish Language and Literature,"sholom, aleichem, mendel, mocher, sforim",Classic Yiddish Authors
Yiddish Language and Literature,"shtetl, diaspora, exile, displacement, migration",Themes of Exile and Diaspora
Yiddish Language and Literature,"holocaust, loss, memory, survival, trauma",Holocaust Themes in Literature
Yiddish Language and Literature,"modernity, tradition, secularism, hasidism, enlightenment",Tradition vs. Modernity
Yiddish Language and Literature,"poetry, drama, fiction, prose, genre",Yiddish Literary Genres
Yiddish Language and Literature,"press, newspaper, journalism, theater, culture",Yiddish Cultural Expression
Other Philosophy,"consciousness, being, existence, phenomenon, subjectivity",Existential Phenomenology
Other Philosophy,"language, meaning, reference, truth, syntax",Analytic Philosophy of Language
Other Philosophy,"aesthetics, beauty, judgment, art, experience",Philosophy of Art and Beauty
Other Philosophy,"rights, obligation, justice, society, governance",Applied Political Philosophy
Other Philosophy,"self, difference, otherness, identity, relationship",Philosophy of the Other
Other Philosophy,"technology, ethics, data, artificial, future",Emerging Technologies and Ethics
Other Philosophy,"knowledge, evidence, justification, belief, skepticism",Contemporary Epistemology Issues
Philosophy of Language,"reference, sense, meaning, names, frege",Theories of Reference
Philosophy of Language,"truth, conditions, tarski, semantics, model",Formal Semantic Theories
Philosophy of Language,"speech, acts, locutionary, illocutionary, perlocutionary",Speech Act Theory
Philosophy of Language,"innateness, chomsky, grammar, modularity, syntax",Language and Cognition
Philosophy of Language,"pragmatics, context, implicature, grice, conversational",Pragmatics and Context
Philosophy of Language,"compositionality, parts, whole, structure, syntax",Principle of Compositionality
Philosophy of Language,"vague, sorites, paradox, borderline, precisification",Vagueness in Language
Rhetoric,"logos, ethos, pathos, audience, persuasion",Classical Appeals to Persuasion
Rhetoric,"invention, arrangement, style, memory, delivery",The Five Canons of Rhetoric
Rhetoric,"metaphor, irony, alliteration, anastrophe, figures",Tropes and Figures of Speech
Rhetoric,"forensic, epideictic, deliberative, time, genre",Aristotle's Rhetorical Genres
Rhetoric,"visual, image, culture, meaning, communication",Visual and Cultural Rhetoric
Rhetoric,"claim, evidence, warrant, argument, reasoning",Components of Rhetorical Argument
Rhetoric,"kairos, timing, context, exigence, setting",Rhetorical Situation and Timing
Diplomatic History,"treaty, negotiation, agreement, ratification, pact",International Treaty Formulation
Diplomatic History,"ambassador, envoy, mission, protocol, immunity",Diplomatic Practice & Protocol
Diplomatic History,"foreign, policy, strategy, relations, statecraft",Foreign Policy Strategy
Diplomatic History,"cold, war, detente, containment, bipolarity",Cold War Diplomacy
Diplomatic History,"conference, summit, congress, mediation, settlement",Major Diplomatic Conferences
Diplomatic History,"power, balance, hegemony, alliance, interstate",Great Power Relations
Diplomatic History,"crisis, intervention, conflict, security, warfare",Diplomacy in Crisis
Latin American Literature,"fantastic, reality, marquez, borges, cortázar",Magical Realism & The Fantastic
Latin American Literature,"modernismo, symbolism, aesthetics, identity, poetry",Modernismo Literary Movement
Latin American Literature,"dictatorship, protest, politics, resistance, testimonio",Politics and Resistance Literature
Latin American Literature,"identity, inequality, social, injustice, historical",Social and Political Themes
Latin American Literature,"indigenismo, creole, transculturation, nation, caribbean",Identity and Cultural Terms
Latin American Literature,"boom, experimental, vanguard, novel, narrative",The Latin American Boom
Latin American Literature,"postcolonial, subaltern, theory, cultural, decolonization",Postcolonial Literary Theory
United States History,"slavery, civil, abolition, secession, reconstruction",Civil War and Reconstruction
United States History,"constitution, republic, federalist, revolution, independence",Founding of the Republic
United States History,"immigration, urbanization, industrialization, progressivism, muckrakers",
United States History,"depression, new, deal, roosevelt, economy",Great Depression and New Deal
United States History,"rights, segregation, protest, movement, activism",Civil Rights Movement
United States History,"frontier, westward, expansion, settlers, indigenous",Westward Expansion and Frontier
United States History,"cold, soviet, nuclear, containment, korea",The Cold War Era
Christian Denominations and Sects,"pope, bishops, magisterium, sacraments, vatican",Catholic Hierarchy and Doctrine
Christian Denominations and Sects,"reformation, luther, calvin, protestantism, theology",Protestant Reformation History
Christian Denominations and Sects,"orthodox, patriarchs, icons, liturgy, schism",Eastern Orthodox Traditions
Christian Denominations and Sects,"baptism, communion, rituals, worship, practice",Sacraments and Worship Practices
Christian Denominations and Sects,"fundamentalism, evangelical, bible, scripture, conservative",Evangelical and Fundamentalist Movements
Christian Denominations and Sects,"anabaptists, quakers, nonconformity, puritans, revivalism",Radical and Nonconformist Sects
Christian Denominations and Sects,"doctrine, heresy, creeds, councils, christology",Early Christian Doctrinal Disputes
Micronesian Studies,"navigation, stars, canoe, voyaging, swell",Traditional Seafaring and Navigation
Micronesian Studies,"language, austronesian, chamorro, chuukese, yapese",Micronesian Languages and Linguistics
Micronesian Studies,"climate, sea-level, threats, islands, adaptation",Climate Change and Adaptation
Micronesian Studies,"cultural, studies, government, issues, politics",Contemporary Micronesian Governance
Micronesian Studies,"invasive, species, biodiversity, ecosystem, conservation",Biodiversity and Conservation Threats
Micronesian Studies,"lineage, matrilineal, kinship, clans, society",Social Structure and Kinship
Micronesian Studies,"colonialism, process, trusteeship, post-colonial, independence",Colonial and Post-Colonial History
Portuguese Literature,"camões, lusiads, epic, renaissance, poem",Camões' Epic Poetry
Portuguese Literature,"pessoa, heteronyms, modernism, poetry, disquiet",Fernando Pessoa and Modernism
Portuguese Literature,"queirós, maias, realism, novel, society",Eça de Queirós' Realism
Portuguese Literature,"saramago, blindness, nobel, allegory, prose",José Saramago's Prose
Portuguese Literature,"galician, lyric, poetry, troubadour, cantigas",Medieval Lyric Poetry
Portuguese Literature,"vicente, auto, drama, baroque, theatre",Gil Vicente and Theatre
Portuguese Literature,"african, brazilian, literature, postcolonial, lusophone",Lusophone World Literature
Other Italian Language and Literature,"dialect, linguistics, variation, neapolitan, sicilian",Italian Regional Dialects
Other Italian Language and Literature,"philology, textual, manuscripts, edition, variants",Italian Textual Philology
Other Italian Language and Literature,"humanism, renaissance, petrarch, boccaccio, classical",Renaissance Humanism in Literature
Other Italian Language and Literature,"feminist, writers, gender, contemporary, criticism",Contemporary Feminist Literature
Other Italian Language and Literature,"postcolonial, migration, identity, otherness, literature",Postcolonial Italian Literature
Other Italian Language and Literature,"crime, giallo, mystery, novel, genre",Italian Crime Fiction
Other Italian Language and Literature,"dante, comedy, early, vernacular, medieval",Early Italian Vernacular
Music Education,"pedagogy, curriculum, assessment, instruction, learning",Music Teaching and Learning
Music Education,"band, orchestra, choir, ensemble, conducting",Instrumental and Vocal Ensembles
Music Education,"technology, digital, composition, recording, sequencing",Music Technology in Education
Music Education,"creativity, improvisation, composition, aesthetics, expression",Creative Music Making
Music Education,"inclusion, equity, diversity, access, social",Inclusion and Equity in Music
Music Education,"development, cognitive, aural, perception, theory",Musical Skill Development
Music Education,"teacher, professional, training, development, licensure",Music Teacher Preparation
Public History,"museums, exhibits, interpretation, artifacts, audiences",Museum Studies and Interpretation
Public History,"oral, interviews, memory, narrative, community",Oral History Documentation
Public History,"sites, preservation, archaeology, heritage, conservation",Historic Preservation
Public History,"commemoration, memory, monuments, identity, controversy",Public Memory and Commemoration
Public History,"digital, archives, crowdsourcing, virtual, engagement",Digital Public History
Public History,"parks, trails, education, tourism, interpretation",Historical Sites and Tourism
Public History,"ethics, representation, decolonization, community, authority",Ethical Practice in History
Polynesian Studies,"migration, navigators, voyaging, settlement, oceania",Polynesian Migration and Settlement
Polynesian Studies,"genealogy, chiefdoms, mana, tapu, leadership",Social Structure and Hierarchy
Polynesian Studies,"mythology, cosmogony, creation, gods, tradition",Creation Myths and Tradition
Polynesian Studies,"language, linguistics, austronesian, cognates, philology",Polynesian Language Evolution
Polynesian Studies,"colonialism, sovereignty, independence, politics, neocolonialism",Colonial Impact and Politics
Polynesian Studies,"material, culture, tattooing, art, archaeology",Archaeology and Material Culture
Polynesian Studies,"climate, change, sea-level, resilience, environment",Environmental Studies and Climate
Women's Studies,"feminist, theory, patriarchy, critique, power",Foundational Feminist Theory and Critique
Women's Studies,"intersectionality, race, class, sexuality, identity",Intersectionality and Identity Studies
Women's Studies,"gender, socialization, performance, binary, roles",Gender Socialization and Performance
Women's Studies,"violence, sexual, trauma, domestic, agency",Gender-Based Violence and Agency
Women's Studies,"global, transnational, development, activism, movements",Global and Transnational Feminisms
Women's Studies,"labor, wage, economy, care, unpaid",Women in Labor Economics
Women's Studies,"body, health, reproductive, medicalization, politics",Body Politics and Health
Oral History,"interview, narrative, memory, testimony, source",Oral Interview Techniques
Oral History,"ethics, consent, confidentiality, power, trauma",Ethical Issues in Oral History
Oral History,"archive, preservation, metadata, access, digital",Archiving and Preservation
Oral History,"community, local, public, social, project",Community-Based Oral History
Oral History,"subjectivity, interpretation, bias, positionality, reflexivity",Subjectivity and Interpretation
Oral History,"life, story, autobiography, identity, experience",Life Story Interviewing
Oral History,"historical, memory, silence, counter-narrative, public",Memory and Counter-Narratives
Music Practice,"performance, practice, repertoire, interpretation, technique",Instrumental Performance Studies
Music Practice,"pedagogy, teaching, learning, instruction, curriculum",Music Practice Pedagogy
Music Practice,"memorization, recall, cognitive, mental, training",Cognitive Practice Strategies
Music Practice,"improvisation, creativity, spontaneity, jazz, composition",Creative Musical Practice
Music Practice,"vocal, singing, choir, diction, breathing",Vocal Practice Techniques
Music Practice,"ensemble, collaboration, chamber, orchestra, synchrony",Group Music Practice
Music Practice,"instrumental, ergonomics, injury, health, wellbeing",Musician Health and Wellness
Philosophy of Mind,"consciousness, qualia, experience, phenomenal, hard",The Problem of Consciousness
Philosophy of Mind,"dualism, physicalism, materialism, substance, property",Mind-Body Problem Debate
Philosophy of Mind,"intentionality, representation, content, mental, aboutness",Mental Content and Intentionality
Philosophy of Mind,"functionalism, role, turing, computational, machine",Functionalist Theory of Mind
Philosophy of Mind,"free, will, determinism, compatibilism, responsibility",Free Will and Moral Responsibility
Philosophy of Mind,"perception, sense, visual, externalism, embodiment",The Philosophy of Perception
Philosophy of Mind,"folk, psychology, elimination, neuroscience, reduction",Folk Psychology and Reduction
Asian American Studies,"immigration, exclusion, migration, policies, diaspora",Asian Immigration History
Asian American Studies,"model, minority, myth, racism, stereotype",Critique of Model Minority Myth
Asian American Studies,"internment, camps, japanese, wwii, injustice",Japanese American Internment
Asian American Studies,"identity, intergenerational, heritage, assimilation, ethnic",Asian American Identity
Asian American Studies,"labor, transnational, exploitation, workers, globalization",Asian Labor Studies
Asian American Studies,"activism, movements, political, solidarity, resistance",Asian American Political Activism
Asian American Studies,"media, representation, film, literature, visual",Asian American Arts & Media
Comparative Philosophy,"daoism, confucianism, yin, yang, harmony",Classical Chinese Philosophy
Comparative Philosophy,"buddhism, vedanta, nirvana, karma, consciousness",Eastern Metaphysics and Ethics
Comparative Philosophy,"aristotle, plato, epistemology, metaphysics, rationalism",Western Classical Foundations
Comparative Philosophy,"intercultural, dialogue, translation, hermeneutics, difference",Intercultural Philosophical Dialogue
Comparative Philosophy,"self, identity, subjectivity, atman, anatta",Comparative Self Theories
Comparative Philosophy,"existence, phenomenology, sartre, hegel, being",Existential and Phenomenological Comparison
Comparative Philosophy,"justice, rights, duty, virtue, political",Comparative Ethics and Politics
Indigenous Studies,"sovereignty, governance, nationhood, self-determination, treaties",Indigenous Self-Determination & Governance
Indigenous Studies,"language, revitalization, documentation, oral, literacy",Indigenous Language Revitalization
Indigenous Studies,"land, territories, resource, management, environmental",Land & Resource Management
Indigenous Studies,"decolonization, settler, colonialism, resistance, knowledge",Decolonization and Resistance
Indigenous Studies,"cultural, heritage, protocols, traditional, rights",Traditional Cultural Heritage & Rights
Indigenous Studies,"health, wellbeing, disparities, historical, intergenerational",Indigenous Health & Wellbeing
Indigenous Studies,"education, curriculum, pedagogy, community, knowledge",Indigenous Education Practices
"Other History of Art, Architecture,","vernacular, landscape, materials, regional, builders",Vernacular Architectural Studies
"Other History of Art, Architecture,","ephemeral, performance, installation, public, temporary",Ephemeral Art and Architecture
"Other History of Art, Architecture,","museum, collecting, exhibition, curatorial, display",Museum and Curatorial Studies
"Other History of Art, Architecture,","digital, archiving, visualization, modeling, reconstruction",
"Other History of Art, Architecture,","patronage, commission, atelier, artist, workshop",Artistic Production and Patronage
"Other History of Art, Architecture,","urbanism, infrastructure, planning, civic, memory",Infrastructure and Civic Urbanism
"Other History of Art, Architecture,","conservation, restoration, preservation, deterioration, authenticity",Art and Architectural Conservation
Interior Design,"ergonomics, posture, comfort, workspace, wellbeing",Ergonomic Design for Wellbeing
Interior Design,"sustainable, materials, circularity, biophilic, recycled",Sustainable Interior Materials
Interior Design,"color, psychology, mood, perception, lighting",Color and Light Psychology
Interior Design,"texture, fabric, pattern, surface, tactility",Textiles and Surface Design
Interior Design,"space, planning, flow, circulation, layout",Spatial Planning and Layout
Interior Design,"residential, hospitality, commercial, healthcare, retail",Specialized Interior Environments
Interior Design,"smart, technology, integration, automation, interactivity",Smart Home Technology Integration
Metal and Jewelry Arts,"casting, mold, investment, centrifugal, lost-wax",Foundry and Casting Techniques
Metal and Jewelry Arts,"soldering, flux, solder, torch, joins",Metal Joining and Soldering
Metal and Jewelry Arts,"hammering, forming, raising, planishing, repoussé",Metal Forming and Shaping
Metal and Jewelry Arts,"alloy, karat, purity, sterling, gold",Precious Metal Alloys
Metal and Jewelry Arts,"patina, oxidizing, finishing, surface, texturing",Metal Surface Treatment
Metal and Jewelry Arts,"gemstone, setting, prong, bezel, facet",Gemstone Setting Methods
Metal and Jewelry Arts,"etching, engraving, acid, resist, chasing",Decorative Metal Techniques
Printmaking,"plate, etching, acid, aquatint, intaglio",Intaglio Etching Processes
Printmaking,"lithography, stone, grease, tusche, offset",Techniques in Lithography
Printmaking,"woodcut, linocut, relief, brayer, block",Relief Printing Methods
Printmaking,"screen, stencil, mesh, squeegee, serigraphy",Screen Printing and Serigraphy
Printmaking,"paper, ink, press, registration, edition",Print Production Essentials
Printmaking,"monotype, trace, ghost, unique, transfer",Monotype and Unique Prints
Printmaking,"digital, giclee, pigment, reproduction, hybrid",Modern Digital Printmaking
Sculpture,"marble, carving, stone, subtractive, chisel",Stone Carving Techniques
Sculpture,"bronze, casting, mould, modeling, lost-wax",Bronze Casting and Modeling
Sculpture,"installation, site-specific, viewer, immersive, space",Installation and Site-Specific Sculpture
Sculpture,"assemblage, found, welding, joining, construction",Assemblage and Construction Methods
Sculpture,"figure, form, humanism, idealism, classical",Classical Figurative Sculpture
Sculpture,"kinetic, movement, digital, 3d-printing, technology",Kinetic and Digital Sculpture
Sculpture,"public, monumental, urban, materiality, scale",Public and Monumental Sculpture
Ancient Philosophy,"virtue, ethics, eudaimonia, aristotle, character",Aristotelian Ethics & Virtue
Ancient Philosophy,"plato, forms, knowledge, metaphysics, recollection",Plato's Theory of Forms
Ancient Philosophy,"stoicism, logos, nature, epictetus, reason",Foundations of Stoicism
Ancient Philosophy,"cosmology, physis, milesian, arche, pre-socratic",Pre-Socratic Cosmology
Ancient Philosophy,"atomism, leucippus, democritus, void, matter",Ancient Greek Atomism
Ancient Philosophy,"epicureanism, ataraxia, pleasure, pain, simplicity",Epicurean Tranquility and Pleasure
Ancient Philosophy,"logic, syllogism, dialectic, categories, organon",Aristotelian Logic and Dialectic
Performance Studies,"performativity, gender, identity, butler, social",Gender and Identity Performativity
Performance Studies,"ritual, ceremony, efficacy, turner, social",Ritual and Social Performance
Performance Studies,"ethnography, culture, fieldwork, embodiment, ecology",Performance Ethnography and Culture
Performance Studies,"audience, engagement, reception, spectator, interaction",Audience and Reception Studies
Performance Studies,"space, site-specific, environment, context, place",Performance Spaces and Contexts
Performance Studies,"history, archive, restored, behavior, theatre",Performance History and Archives
Performance Studies,"digital, interactive, media, virtual, technology",Digital Performance and Media
Playwriting,"dialogue, subtext, voice, monologue, speech",Theatrical Dialogue and Voice
Playwriting,"structure, plot, action, climax, scenes",Dramatic Structure and Plotting
Playwriting,"character, motivation, development, arc, conflict",Character Creation and Conflict
Playwriting,"setting, stage, design, space, environment",Staging and Scenic Design
Playwriting,"revision, feedback, workshop, dramaturgy, editing",Play Development and Revision
Playwriting,"genre, tragedy, comedy, absurdism, musical",Dramatic Genre Analysis
Playwriting,"theme, message, meaning, intention, purpose",Thematic Exploration in Plays
Theatre History,"greek, tragedy, comedy, dionysus, chorus",Ancient Greek Drama
Theatre History,"medieval, mystery, morality, liturgical, cycle",Medieval Religious Theatre
Theatre History,"renaissance, shakespeare, elizabethan, globe, jonson",Elizabethan and Jacobean Theatre
Theatre History,"restoration, comedy, manners, wits, garrick",English Restoration Theatre
Theatre History,"realism, naturalism, ibsen, chekhov, stantinavsky",19th Century Realism
Theatre History,"modernism, absurd, beckett, brecht, experimental",20th Century Experimental Theatre
Theatre History,"design, scenic, lighting, costume, architecture",Theatre Design and Architecture
Other Theatre and Performance Studies,"embodiment, kinesthesia, practice, movement, choreography",Theories of Embodiment and Movement
Other Theatre and Performance Studies,"queer, gender, sexuality, identity, non-normative",Queer Performance Studies
Other Theatre and Performance Studies,"site-specific, public, intervention, urban, space",Performance in Public Spaces
Other Theatre and Performance Studies,"ritual, sacred, secular, tradition, social",Ritual and Social Performance
Other Theatre and Performance Studies,"digital, virtual, interactivity, technology, media",Digital and Media Performance
Other Theatre and Performance Studies,"ethnography, fieldwork, cultural, context, local",Ethnography of Performance
Other Theatre and Performance Studies,"audience, spectatorship, participation, affect, response",Audience Engagement and Response
Music Business,"streaming, royalties, licensing, digital, platforms",Digital Music Royalties
Music Business,"contracts, negotiation, publishing, copyright, agreements",Music Copyright and Contracts
Music Business,"touring, promotion, venues, management, logistics",Live Music and Touring
Music Business,"marketing, fanbase, social, engagement, branding",Artist Marketing and Branding
Music Business,"finance, investment, valuation, revenue, capital",Music Industry Finance
Music Business,"distribution, independent, label, aggregators, supply",Independent Music Distribution
Music Business,"data, analytics, consumption, trends, forecasting",Music Consumption Data
Leadership,"transformational, inspiration, motivation, vision, charisma",Transformational Leadership Style
Leadership,"follower, leader-member, exchange, relationship, dyadic",Leader-Follower Exchange Theory
Leadership,"authentic, self-awareness, transparency, moral, integrity",Authentic Leadership Development
Leadership,"servant, ethics, stewardship, community, subordinates",Servant Leadership Ethics
Leadership,"trait, skills, personality, intelligence, competencies",Leadership Traits and Skills
Leadership,"contingency, situational, path-goal, context, effectiveness",Situational Leadership Models
Leadership,"culture, organizational, change, strategy, innovation",Organizational Leadership and Change
Food and Beverage Management,"inventory, cost, waste, portion, control",Food Cost Control
Food and Beverage Management,"service, guest, experience, satisfaction, complaint",Customer Service and Experience
Food and Beverage Management,"hiring, training, scheduling, labor, retention",Staff and Labor Management
Food and Beverage Management,"safety, haccp, health, temperature, sanitation",Food Safety and Hygiene
Food and Beverage Management,"menu, pricing, engineering, profit, design",Menu Pricing and Strategy
Food and Beverage Management,"supply, chain, supplier, purchasing, logistics",Supply Chain Management
Food and Beverage Management,"technology, pos, automation, erp, operations",F&B Technology and Operations
Gaming and Casino Operations Management,"patron, retention, loyalty, marketing, experience",Player Loyalty and Retention
Gaming and Casino Operations Management,"table, slots, floor, efficiency, management",Casino Floor Operations
Gaming and Casino Operations Management,"responsible, gambling, self-exclusion, harm, prevention",Responsible Gaming Initiatives
Gaming and Casino Operations Management,"regulation, licensing, compliance, jurisdiction, policy",Gaming Regulation and Compliance
