research_field,topic_label,topic_words
Artificial Intelligence & Emerging Technologies in Marketing,AI Customer Service Chatbots,"chatbot, service, support, conversation, interaction"
Artificial Intelligence & Emerging Technologies in Marketing,AI-Driven SEO & Search,"semantic, seo, keyword, search, nlp"
Artificial Intelligence & Emerging Technologies in Marketing,Immersive Marketing Experiences,"augmented, reality, virtual, experience, immersive"
Consumer Behavior & Purchase Intentions,Theory of Planned Behavior,"attitude, subjective, control, theory, reasoned"
Consumer Behavior & Purchase Intentions,Consumer Decision Making,"emotion, affective, cognitive, processing, decision"
Consumer Behavior & Purchase Intentions,Digital Purchase Intentions,"online, trust, reviews, e-commerce, platform"
Consumer Behavior & Purchase Intentions,Customer Behavior,"loyalty, satisfaction, retention, switching, post-purchase"
Consumer Behavior & Purchase Intentions,Perceived Value and Price,"perceived, value, price, quality, sacrifice"
Consumer Behavior & Purchase Intentions,Social Influence on Buying,"social, influence, reference, group, normative"
Consumer Behavior & Purchase Intentions,S-O-R Model Applications,"stimulus, organism, response, environment, model"
Tourism & Hospitality Marketing,Destination Branding and Marketing,"destination, branding, image, perception, marketing"
Tourism & Hospitality Marketing,Online Reputation Management,"online, review, reputation, management, sentiment"
Tourism & Hospitality Marketing,Customer Experience Design,"experience, design, co-creation, customer, satisfaction"
Tourism & Hospitality Marketing,Social Media Marketing,"social, media, influencer, engagement, content"
Tourism & Hospitality Marketing,Sustainable Tourism Marketing,"sustainability, ecotourism, responsibility, green, practices"
Tourism & Hospitality Marketing,Revenue and Pricing Strategy,"pricing, revenue, management, yield, strategy"
Tourism & Hospitality Marketing,Targeting and Customer Loyalty,"segmentation, targeting, behavior, loyalty, personalization"
Green & Sustainable Marketing,Sustainable Consumer Behavior,"consumer, behavior, purchase, intentions, willingness"
Green & Sustainable Marketing,Combating Greenwashing & Mistrust,"greenwashing, deception, trust, skepticism, authenticity"
Green & Sustainable Marketing,Corporate Social Responsibility in Marketing,"csr, social, responsibility, ethics, reporting"
Green & Sustainable Marketing,Sustainable Supply Chain Communication,"supply, chain, sourcing, transparency, logistics"
Green & Sustainable Marketing,Eco-Friendly Product Innovation,"product, eco-friendly, design, innovation, lifecycle"
Green & Sustainable Marketing,Sustainable Packaging Strategy,"packaging, recycling, biodegradable, waste, reduction"
Green & Sustainable Marketing,Green Marketing Communications,"campaign, messaging, communication, framing, persuasion"
Data Lakes & Big Data Management,Scalable Data Lake Storage,"storage, data, schema, hadoop, cloud"
Data Lakes & Big Data Management,Data Ingestion and Pipelines,"ingestion, pipeline, streaming, batch, etl"
Data Lakes & Big Data Management,Data Governance and Security,"governance, security, privacy, compliance, access"
Data Lakes & Big Data Management,Data Quality and Metadata,"quality, cleansing, profiling, metadata, catalog"
Data Lakes & Big Data Management,Big Data Processing & Analytics,"processing, spark, query, analytics, realtime"
Data Lakes & Big Data Management,Modern Data Architecture Design,"architecture, modern, design, platform, warehouse"
Data Lakes & Big Data Management,Data Lake Cost Optimization,"optimization, cost, performance, tiering, index"
Data Mining & Trajectory Analysis,Movement Pattern Analysis,"movement, pattern, detection, sequence, analysis"
Data Mining & Trajectory Analysis,Spatial-Temporal Data Mining,"location, gps, spatial, temporal, data"
Data Mining & Trajectory Analysis,Trajectory Clustering & Segmentation,"clustering, segmentation, grouping, similarity, routes"
Data Mining & Trajectory Analysis,Trajectory Prediction Models,"prediction, forecasting, future, next, destination"
Data Mining & Trajectory Analysis,Anomaly Detection in Trajectories,"anomalies, outliers, deviation, unusual, abnormal"
Data Mining & Trajectory Analysis,Frequent Trajectory Pattern Mining,"mining, frequent, subsequences, patterns, paths"
Data Mining & Trajectory Analysis,Trajectory Data Privacy,"privacy, protection, anonymization, security, k-anonymity"
Enterprise Systems & Business Performance,ERP System Implementation,"erp, sap, implementation, modules, integration"
Enterprise Systems & Business Performance,Supply Chain Management,"scm, supply, chain, logistics, inventory"
Enterprise Systems & Business Performance,Customer Relationship Management,"crm, customer, relationship, management, salesforce"
Enterprise Systems & Business Performance,Key Performance Indicators,"kpi, metrics, dashboard, reporting, measurement"
Enterprise Systems & Business Performance,Business Process Management,"process, optimization, bpm, workflow, reengineering"
Enterprise Systems & Business Performance,Business Intelligence & Data,"data, analytics, bi, intelligence, decision"
Enterprise Systems & Business Performance,Enterprise Performance Management,"epm, planning, budgeting, financial, forecasting"
Cybersecurity & Advanced Computing Applications,Vulnerability and Risk Management,"vulnerability, patching, management, risk, assessment"
Cybersecurity & Advanced Computing Applications,Advanced Cryptographic Systems,"encryption, quantum, post-quantum, cryptography, algorithms"
Cybersecurity & Advanced Computing Applications,High Performance Computing,"high, performance, parallel, supercomputing, simulation"
Cybersecurity & Advanced Computing Applications,Intrusion Detection Systems,"network, intrusion, detection, monitoring, traffic"
Cybersecurity & Advanced Computing Applications,IoT Device Security,"iot, sensor, device, security, protocols"
Islamic Architecture and Heritage,Mosque Architecture Elements,"mosque, domes, minarets, hypostyle, sahn"
Islamic Architecture and Heritage,Islamic Decorative Arts,"geometric, calligraphy, ornamentation, muqarnas, tile"
Islamic Architecture and Heritage,Planning and Public Spaces,"courtyards, gardens, water, fountain, space"
Islamic Architecture and Heritage,Cross-Cultural Architectural Influences,"roman, byzantine, persian, chinese, influence"
Islamic Architecture and Heritage,Types of Islamic Buildings,"madrasa, tomb, palace, caravanserai, hammam"
Islamic Architecture and Heritage,Architectural Heritage Conservation,"preservation, restoration, conservation, documentation, site"
Islamic Architecture and Heritage,Structural Systems,"arches, vaulting, dome, structure, construction"
"Design, Innovation, and Cultural Heritage",Digital Heritage Preservation,"heritage, preservation, digital, archive, documentation"
"Design, Innovation, and Cultural Heritage",Culture-Driven Design Innovation,"innovation, design, creative, culture, technology"
"Design, Innovation, and Cultural Heritage",Immersive Museum Experiences,"museum, experience, interactive, digital, exhibition"
"Design, Innovation, and Cultural Heritage",Traditional Craftsmanship Rebirth,"traditional, craftsmanship, modern, reuse, aesthetics"
"Design, Innovation, and Cultural Heritage",Participatory Heritage Narratives,"participatory, co-creation, community, narrative, engagement"
"Design, Innovation, and Cultural Heritage",3D Artifact Recognition,"artifact, recognition, three-dimensional, modeling, virtual"
"Design, Innovation, and Cultural Heritage",Sustainable Cultural Renewal,"sustainability, renewal, urban, architecture, landscape"
Emerging Applications in Architecture and Materials,3D-Printed Graphene Composites,"graphene, additive, layer, printing, composite"
Emerging Applications in Architecture and Materials,Cross-Laminated Timber (CLT) Structures,"lumber, cross, laminated, wood, mass"
Emerging Applications in Architecture and Materials,Smart and Self-Healing Materials,"concrete, bioplastic, self, healing, smart"
Emerging Applications in Architecture and Materials,AI in Generative Design,"generative, design, algorithm, form, optimization"
Emerging Applications in Architecture and Materials,IoT for Building Performance,"sensing, hvac, iot, systems, monitoring"
Emerging Applications in Architecture and Materials,Carbon Fiber Reinforcement,"carbon, fiber, strength, lightweight, reinforcement"
Emerging Applications in Architecture and Materials,Innovative Translucent Building Materials,"translucent, insulation, energy, efficiency, façade"
Applications of Nanomaterials,Targeted Drug Delivery Systems,"drug, delivery, targeted, therapeutics, nanocarrier"
Applications of Nanomaterials,Nanomaterial-Based Sensor Technology,"sensor, detection, chemical, biosensor, sensitivity"
Applications of Nanomaterials,Nanomaterials for Solar Energy,"photovoltaic, solar, energy, efficiency, quantum"
Applications of Nanomaterials,Nanocatalysis and Surface Chemistry,"catalysis, reaction, surface, activity, selectivity"
Applications of Nanomaterials,Nano-Energy Storage Devices,"storage, battery, supercapacitor, electrode, rechargeable"
Applications of Nanomaterials,Nanocomposite and Nanocoating Development,"coating, composite, mechanical, reinforcement, polymer"
Applications of Nanomaterials,Nanomaterials for Biomedical Imaging,"imaging, contrast, biomedical, diagnosis, fluorescence"
Computational and Theoretical Materials Science,Density Functional Theory,"density, functional, theory, electronic, structure"
Computational and Theoretical Materials Science,Molecular Dynamics Simulations,"molecular, dynamics, simulation, atomistic, interactions"
Computational and Theoretical Materials Science,Kinetic Monte Carlo Modeling,"kinetic, monte, carlo, atomistic, events"
Computational and Theoretical Materials Science,Dislocation Dynamics and Defects,"dislocation, dynamics, crystal, plasticity, defects"
Computational and Theoretical Materials Science,Phase Field Microstructure Modeling,"phase, field, microstructure, evolution, grain"
Computational and Theoretical Materials Science,First-Principles Material Properties,"first-principles, calculation, properties, quantum, material"
Computational and Theoretical Materials Science,Modeling Nanomaterials,"nanomaterials, graphene, semiconductors, quantum, two-dimensional"
Nanomaterials and Low-Dimensional Materials,Carbon Nanomaterials and 2D,"graphene, nanotubes, 2d, carbon, heterostructures"
Nanomaterials and Low-Dimensional Materials,Quantum Dot Optoelectronics,"quantum, dots, nanocrystals, photoluminescence, semiconductor"
Nanomaterials and Low-Dimensional Materials,Perovskite Nanocrystal Applications,"perovskite, solar, cells, optoelectronic, nanocrystals"
Nanomaterials and Low-Dimensional Materials,Nanomaterials for Biomedical Use,"nanomedicine, delivery, targeted, biomedical, biosensing"
Nanomaterials and Low-Dimensional Materials,Nanomaterials Synthesis Methods,"synthesis, fabrication, chemical, exfoliation, deposition"
Nanomaterials and Low-Dimensional Materials,Nanoelectronic Device Applications,"sensors, transistor, nanodevices, nanoelectronics, memristors"
Nanomaterials and Low-Dimensional Materials,Environmental Nanocatalysis,"catalysis, nanocatalysts, environmental, sorption, purification"
Microbial Control and Biophysics,Biofilm Control Strategies,"biofilm, formation, adhesion, surface, inhibition"
Microbial Control and Biophysics,Antimicrobial Resistance Mechanisms,"antimicrobial, resistance, mechanism, drug, susceptibility"
Microbial Control and Biophysics,Cell Membrane Biophysics,"membrane, disruption, structure, permeability, lipids"
Microbial Control and Biophysics,Radiation for Microbial Inactivation,"radiation, uv, gamma, sterilization, dna"
Microbial Control and Biophysics,Chemical Control Agents,"chemical, disinfectant, antiseptic, mode, action"
Microbial Control and Biophysics,Microbial Imaging Techniques,"fluorescence, microscopy, imaging, single-cell, dynamics"
Microbial Control and Biophysics,Thermal Control of Microbes,"temperature, heat, cryopreservation, growth, inactivation"
Bioelectromagnetics / Magnetic Field Therapy,Pulsed Electromagnetic Field Therapy,"pulsed, pemf, fields, therapy, magnetic"
Bioelectromagnetics / Magnetic Field Therapy,Cellular Mechanisms and Signaling,"cellular, biological, mechanisms, signaling, function"
Bioelectromagnetics / Magnetic Field Therapy,Tissue Healing and Regeneration,"healing, bone, tissue, regeneration, osteogenesis"
Bioelectromagnetics / Magnetic Field Therapy,Pain and Inflammation Relief,"pain, inflammation, analgesic, musculoskeletal, relief"
Bioelectromagnetics / Magnetic Field Therapy,Bioelectromagnetism in Neurology,"neurostimulation, brain, eeg, meg, tms"
Bioelectromagnetics / Magnetic Field Therapy,Bioelectromagnetics Safety and Risk,"bioelectromagnetics, exposure, risk, safety, health"
Bioelectromagnetics / Magnetic Field Therapy,Therapy Device Optimization,"frequency, intensity, device, design, optimization"
Vector Calculus,Scalar Field Gradients,"gradient, scalar, field, directional, derivative"
Vector Calculus,Vector Field Divergence,"divergence, flux, volume, density, vector"
Vector Calculus,Vector Field Curl,"curl, rotation, circulation, field, vorticity"
Vector Calculus,Line Integrals & Work,"line, integral, path, work, curve"
Vector Calculus,Surface Integrals & Flux,"surface, integral, flux, area, normal"
Vector Calculus,Vector Calculus Theorems,"greens, stokes, theorem, divergence, fundamental"
Vector Calculus,Conservative Vector Fields,"potential, function, conservative, field, irrotational"
Discrete Mathematics,Graph Theory Fundamentals,"vertices, edges, paths, coloring, networks"
Discrete Mathematics,Advanced Combinatorial Counting,"counting, permutations, combinations, selection, enumeration"
Discrete Mathematics,Foundational Mathematical Concepts,"sets, relations, functions, logic, proofs"
Discrete Mathematics,Elementary Number Theory,"divisibility, prime, congruence, modular, cryptography"
Discrete Mathematics,Mathematical Logic and Proof,"boolean, tautology, predicates, quantifiers, inference"
Discrete Mathematics,Discrete and Combinatorial Optimization,"matroids, optimization, linear, integer, polyhedra"
Probability and Statistics,Random Variable Distributions,"distribution, probability, discrete, continuous, random"
Probability and Statistics,Statistical Hypothesis Testing,"hypothesis, testing, significance, null, alternative"
Probability and Statistics,Linear Regression Modeling,"regression, linear, model, variable, prediction"
Probability and Statistics,Bayesian Statistical Inference,"bayesian, inference, prior, posterior, likelihood"
Probability and Statistics,Sampling Theory and Methods,"sampling, population, sample, bias, error"
Probability and Statistics,Correlation and Covariance Analysis,"correlation, covariance, relationship, scatter, data"
Differential Equations,Ordinary Differential Equations Analysis,"ordinary, existence, uniqueness, stability, bifurcation"
Differential Equations,Nonlinear Dynamics and Chaos,"dynamical, system, chaos, nonlinear, attractor"
Differential Equations,Stochastic Differential Equations,"stochastic, wiener, ito, calculus, random"
Differential Equations,Boundary Value Problems,"boundary, eigenvalue, value, initial, conditions"
Differential Equations,Applied DE and Modeling,"modeling, applied, simulation, physical, equations"