research_field,topic_label,topic_words
Analytical Chemistry & Separation Science,Capillary & Microfluidic Separation,"capillary, electrophoresis, microfluidic, separation, chip"
Analytical Chemistry & Separation Science,Analytical Method Validation,"calibration, validation, accuracy, precision, method"
Natural Products Chemistry & Bioactive Compounds,Natural Product Isolation,"extraction, purification, chromatography, isolation, compound"
Natural Products Chemistry & Bioactive Compounds,Secondary Metabolite Classes,"phytochemicals, alkaloids, flavonoids, terpenoids, saponins"
Natural Products Chemistry & Bioactive Compounds,Compound Structure Elucidation,"spectroscopy, nmr, mass, structure, elucidation"
Natural Products Chemistry & Bioactive Compounds,Bioactive Compound Screening,"antioxidant, antimicrobial, anticancer, bioassay, activity"
Natural Products Chemistry & Bioactive Compounds,Traditional Medicine Sources,"medicinal, plants, traditional, herbal, ethnobotany"
Natural Products Chemistry & Bioactive Compounds,Natural Product Biosynthesis,"biosynthesis, pathway, enzymes, genes, metabolism"
Natural Products Chemistry & Bioactive Compounds,Natural Products in Drug Discovery,"drug, discovery, lead, optimization, pharmacology"
"Metabolomics, Biomarkers & Clinical Chemistry",Targeted Metabolite Profiling,"metabolite, profiling, quantification, mass, spectrometry"
"Metabolomics, Biomarkers & Clinical Chemistry",NMR-Based Metabolite Identification,"nmr, spectroscopy, biofluid, analysis, identification"
"Metabolomics, Biomarkers & Clinical Chemistry",Biomarker Discovery and Validation,"biomarker, discovery, diagnosis, prognosis, validation"
"Metabolomics, Biomarkers & Clinical Chemistry",Clinical Chemistry Quality,"clinical, testing, assays, reference, quality"
"Metabolomics, Biomarkers & Clinical Chemistry",Metabolomics Data Analysis,"data, preprocessing, statistics, modeling, multivariate"
"Metabolomics, Biomarkers & Clinical Chemistry",Metabolic Disease Mechanisms,"disease, metabolic, pathways, mechanism, perturbation"
"Metabolomics, Biomarkers & Clinical Chemistry",Biological Sample Preparation,"urine, plasma, tissue, sample, preparation"
Method Development in Pharmaceutical Analysis,HPLC Method Validation,"hplc, chromatography, validation, separation, quantitative"
Method Development in Pharmaceutical Analysis,Spectroscopic Analysis Techniques,"spectroscopy, uv-vis, mass, identification, detection"
Method Development in Pharmaceutical Analysis,Impurity and Stability Testing,"impurity, degradation, stability, stress, monitoring"
Method Development in Pharmaceutical Analysis,LC-MS/MS Bioanalysis,"bioanalysis, plasma, lc-ms/ms, pharmacokinetics, drug"
Method Development in Pharmaceutical Analysis,Capillary Electrophoresis Development,"capillary, electrophoresis, separation, chiral, ce"
Method Development in Pharmaceutical Analysis,Green Analytical Chemistry,"green, microextraction, solvent, sustainable, miniaturization"
Method Development in Pharmaceutical Analysis,Electrochemical Assay Development,"titration, potentiometry, voltammetry, electrochemical, sensors"
Epigenetic RNA Modifications (m6A) & Immune Regulation,m6A RNA Methylation Dynamics,"m6a, methylation, mrna, regulator, epigenetic"
Epigenetic RNA Modifications (m6A) & Immune Regulation,m6A in Autoimmune Diseases,"autoimmune, disease, inflammation, pathogenesis, therapy"
Epigenetic RNA Modifications (m6A) & Immune Regulation,m6A Writer/Reader/Eraser Enzymes,"mettl3, writer, demethylase, reader, complex"
Epigenetic RNA Modifications (m6A) & Immune Regulation,m6A in Adaptive Immunity,"t-cell, b-cell, macrophage, dendritic, lymphocyte"
Epigenetic RNA Modifications (m6A) & Immune Regulation,m6A and Gene Expression,"gene, expression, stability, translation, rna"
Epigenetic RNA Modifications (m6A) & Immune Regulation,m6A and Cancer Immunity,"cancer, immunity, tumor, microenvironment, immunotherapy"
Immunogenetics & Cardiometabolic Disease Risk,Genetic Risk Loci Identification,"gwas, snps, association, genetics, risk"
Immunogenetics & Cardiometabolic Disease Risk,Immune-Metabolic Crosstalk,"inflammation, cytokines, immunity, atherosclerosis, metabolism"
Immunogenetics & Cardiometabolic Disease Risk,HLA and Autoimmune Risk,"hla, mhc, autoimmunity, t-cell, antigen"
Immunogenetics & Cardiometabolic Disease Risk,Epigenetic Regulation of Disease,"epigenetics, methylation, histone, regulation, environment"
Immunogenetics & Cardiometabolic Disease Risk,Genetic Basis of Dyslipidemia,"lipids, cholesterol, triglycerides, dyslipidemia, genes"
Immunogenetics & Cardiometabolic Disease Risk,Genetics of Type 2 Diabetes,"diabetes, insulin, resistance, glucose, t2d"
Immunogenetics & Cardiometabolic Disease Risk,Microbiome-Immune-Metabolic Axis,"microbiota, gut, microbiome, immune, metabolic"
Health Economics & Epidemiology,Economic Evaluation Methods,"cost, effectiveness, utility, cba, minimization"
Health Economics & Epidemiology,Key Epidemiological Measures,"incidence, prevalence, mortality, morbidity, rate"
Health Economics & Epidemiology,Health Policy & Finance,"policy, health, insurance, spending, access"
Health Economics & Epidemiology,Health Economic Modeling,"modeling, simulation, markov, cohort, decision"
Health Economics & Epidemiology,Risk & Association Analysis,"risk, ratio, exposure, outcome, association"
Health Economics & Epidemiology,Burden of Disease,"disease, burden, qaly, daly, outcomes"
Health Economics & Epidemiology,Health Promotion Strategies,"prevention, promotion, intervention, behavior, public"
Neurodegenerative Diseases & Neurological Disorders,Alzheimer's Disease Pathology,"dementia, amyloid, tau, plaques, atrophy"
Neurodegenerative Diseases & Neurological Disorders,Parkinson's Disease Movement,"dopamine, tremor, bradykinesia, levodopa, synuclein"
Neurodegenerative Diseases & Neurological Disorders,Amyotrophic Lateral Sclerosis Mechanisms,"motor, neuron, sclerosis, degeneration, cortex"
Neurodegenerative Diseases & Neurological Disorders,Neurological Disease Biomarkers,"biomarker, fluid, imaging, diagnosis, progression"
Neurodegenerative Diseases & Neurological Disorders,Neuroinflammation and Glial Cells,"neuroinflammation, microglia, astrocyte, immune, cytokine"
Neurodegenerative Diseases & Neurological Disorders,Neuronal Degeneration Processes,"axonal, transport, synaptic, misfolding, proteinopathy"
Mitochondrial Function & Oxidative Stress,Oxidative Stress Biomarkers,"lipid, peroxidation, biomarkers, protein, oxidation"
Mitochondrial Function & Oxidative Stress,Mitochondria & Cell Death,"apoptosis, necrosis, cell, death, signaling"
Neuroprotective Therapeutics & Molecular Pathways,Oxidative Stress & Antioxidant Therapy,"oxidative, stress, antioxidants, radicals, scavenging"
Neuroprotective Therapeutics & Molecular Pathways,Molecular Neuroinflammation Pathways,"neuroinflammation, microglia, cytokines, astrocytes, gliosis"
Neuroprotective Therapeutics & Molecular Pathways,Apoptotic and Survival Pathways,"apoptosis, survival, caspases, bcl-2, mitochondria"
Neuroprotective Therapeutics & Molecular Pathways,Neurotrophic Factor Signaling,"neurotrophic, bdnf, gdnf, survival, receptors"
Neuroprotective Therapeutics & Molecular Pathways,Protein Misfolding & Aggregation,"protein, misfolding, aggregation, tau, amyloid"
Neuroprotective Therapeutics & Molecular Pathways,Glutamatergic Excitotoxicity Mechanisms,"glutamate, excitotoxicity, nmda, receptor, antagonists"
Neuroprotective Therapeutics & Molecular Pathways,Ischemic Neuroprotection Strategies,"ischemia, reperfusion, stroke, hypoxia, infarction"
Neuroinflammation,Microglial Activation in CNS,"microglia, activation, neurotoxicity, immune, cns"
Neuroinflammation,Inflammatory Cytokine Signaling,"cytokines, chemokines, signaling, inflammation, mediators"
Neuroinflammation,Reactive Astrogliosis and Support,"astrocytes, gliosis, reactive, neuronal, support"
Neuroinflammation,Blood-Brain Barrier Integrity,"blood, brain, barrier, permeability, disruption"
Neuroinflammation,Neuroinflammation in Disease,"alzheimer's, parkinson's, disease, neurodegeneration, ms"
Neuroinflammation,Neuroinflammation Therapeutic Strategies,"treatment, therapeutic, targets, drug, anti-inflammatory"
Neuroinflammation,Oxidative Stress and Damage,"oxidative, stress, mitochondria, damage, ros"
Molecularly Imprinted Polymers (MIPs) & Biomimetic Sensors,Molecular Imprinting Technology,"molecular, imprinting, template, polymerization, selectivity"
Molecularly Imprinted Polymers (MIPs) & Biomimetic Sensors,Biomimetic Sensor Design,"sensor, biomimetic, recognition, detection, analyte"
Molecularly Imprinted Polymers (MIPs) & Biomimetic Sensors,MIPs for Drug Delivery,"drug, delivery, therapeutics, release, targeting"
Molecularly Imprinted Polymers (MIPs) & Biomimetic Sensors,Biomolecule Recognition,"protein, peptide, binding, biomolecules, affinity"
Molecularly Imprinted Polymers (MIPs) & Biomimetic Sensors,Advanced Sensor Readouts,"biosensing, electrochemical, optical, acoustic, transducer"
Molecularly Imprinted Polymers (MIPs) & Biomimetic Sensors,Surface Modification Techniques,"surface, nanomaterials, modification, microcontact, immobilization"
Molecularly Imprinted Polymers (MIPs) & Biomimetic Sensors,Environmental Analysis using MIPs,"environmental, contaminants, pollutants, remediation, extraction"
Analytical Chemistry & Separation Science,Chromatographic Separation Techniques,"chromatography, liquid, gas, mass, separation"
Analytical Chemistry & Separation Science,Spectroscopic Analysis Methods,"spectroscopy, absorption, emission, atomic, molecular"
Analytical Chemistry & Separation Science,Electrophoretic Separation,"electrophoresis, capillary, gel, separation, biomolecules"
Analytical Chemistry & Separation Science,Analytical Sample Preparation,"sample, preparation, extraction, digestion, clean-up"
Analytical Chemistry & Separation Science,Analytical Detection & LOD,"detection, quantification, limit, linearity, accuracy"
Analytical Chemistry & Separation Science,Mass Spectrometry Analysis,"mass, spectrometry, ionization, fragments, identification"
Analytical Chemistry & Separation Science,Analytical Method Validation,"validation, method, calibration, precision, robustness"
Drug Delivery & Pharmaceutical Applications,Nanoparticle Drug Carriers,"nanoparticles, nanomedicine, liposomes, carriers, stability"
Drug Delivery & Pharmaceutical Applications,Controlled Release Formulations,"controlled, release, formulation, kinetics, extended"
Drug Delivery & Pharmaceutical Applications,Targeted Drug Delivery,"targeted, delivery, ligand, receptor, site"
Drug Delivery & Pharmaceutical Applications,Drug Bioavailability & Kinetics,"bioavailability, solubility, absorption, pharmacokinetics, distribution"
Drug Delivery & Pharmaceutical Applications,Gene Therapy Delivery,"gene, therapy, rna, vector, nucleic"
Drug Delivery & Pharmaceutical Applications,Transdermal Drug Delivery,"transdermal, microneedle, patch, skin, absorption"
Drug Delivery & Pharmaceutical Applications,Protein and Peptide Delivery,"peptide, protein, stability, formulation, degradation"
Nanomaterials & Smart Polymers,Nanoparticle Synthesis and Characterization,"nanoparticles, synthesis, characterization, morphology, applications"
Nanomaterials & Smart Polymers,Nanomaterials for Drug Delivery,"drug, delivery, release, biocompatibility, therapeutic"
Nanomaterials & Smart Polymers,Stimuli-Responsive Smart Polymers,"hydrogel, stimuli, responsive, shape, memory"
Nanomaterials & Smart Polymers,Polymer Nanocomposite Properties,"polymer, nanocomposites, mechanical, electrical, thermal"
Nanomaterials & Smart Polymers,Nanomaterial-Based Sensor Development,"sensors, biosensors, detection, surface, functionalization"
Nanomaterials & Smart Polymers,Self-Healing and Flexible Polymers,"self, healing, actuator, fabrication, flexible"
Nanomaterials & Smart Polymers,Polymer Scaffolds for Tissue Engineering,"scaffolds, tissue, engineering, regenerative, biomaterials"
Organizational Behavior & Impression Management,Impression Management Behaviors,"behavior, verbal, nonverbal, social, interaction"
Organizational Behavior & Impression Management,Online Impression Management,"online, social, networking, identity, profile"
Organizational Behavior & Impression Management,Defensive Impression Tactics,"defensive, apology, excuse, justification, acounting"
Organizational Behavior & Impression Management,Self-Presentation Theory,"presentation, perception, audience, self-monitoring, motive"
"Human Resources, Personnel Selection & Workplace Psychology",Personnel Selection Methods,"recruitment, screening, interview, assessment, criteria"
"Human Resources, Personnel Selection & Workplace Psychology",Employee Well-being and Engagement,"engagement, satisfaction, motivation, wellbeing, culture"
"Human Resources, Personnel Selection & Workplace Psychology",Performance Management Systems,"performance, appraisal, feedback, management, metrics"
"Human Resources, Personnel Selection & Workplace Psychology",Psychometric Assessment in Selection,"personality, cognition, ability, testing, psychometrics"
"Human Resources, Personnel Selection & Workplace Psychology",Workplace Training and Development,"training, development, learning, skills, competencies"
"Human Resources, Personnel Selection & Workplace Psychology",Employee Relations and Compliance,"relations, compliance, policies, legal, conflict"
"Human Resources, Personnel Selection & Workplace Psychology",Organizational Behavior and Leadership,"leadership, teams, group, dynamics, organization"
Cross-Cultural Management & Society-Work Dynamics,Cultural Dimension Influence,"cultural, dimensions, hofstede, influence, management"
Cross-Cultural Management & Society-Work Dynamics,Diversity and Team Performance,"diversity, performance, teams, multicultural, strategy"
Cross-Cultural Management & Society-Work Dynamics,Expatriate Success and Adjustment,"expatriate, adjustment, repatriation, success, global"
Cross-Cultural Management & Society-Work Dynamics,Intercultural Communication Challenges,"communication, barriers, intercultural, multinational, language"
Cross-Cultural Management & Society-Work Dynamics,Global Negotiation and Conflict,"negotiation, styles, conflict, resolution, international"
Cross-Cultural Management & Society-Work Dynamics,Cultural Intelligence and Leadership,"cultural, intelligence, competence, leadership, globalization"
Workplace Spirituality & Applied Organizational Ethics,Meaning and Purpose at Work,"purpose, meaning, calling, fulfillment, transcendence"
Workplace Spirituality & Applied Organizational Ethics,Organizational Ethics and Integrity,"values, integrity, conduct, dilemmas, governance"
Workplace Spirituality & Applied Organizational Ethics,Ethical and Spiritual Leadership,"leadership, servant, authentic, ethical, conscious"
Workplace Spirituality & Applied Organizational Ethics,Corporate Social Responsibility Ethics,"sustainability, csr, stakeholder, impact, responsibility"
Islamic Marketing & Consumer Behavior,Halal and Shariah Compliance,"halal, shariah, compliance, forbidden, permitted"
Islamic Marketing & Consumer Behavior,Ethical Marketing Practices,"truthfulness, honesty, justice, fairness, ethics"
Islamic Marketing & Consumer Behavior,Core Islamic Principles in Business,"tawhid, oneness, values, principles, integrity"
Islamic Marketing & Consumer Behavior,Social Responsibility in Islamic Marketing,"social, responsibility, community, wellbeing, charitable"
Islamic Marketing & Consumer Behavior,Consumer Trust and Ethical Consumption,"trust, confidence, ethical, responsible, consumption"
Islamic Marketing & Consumer Behavior,Halal Supply Chain and Logistics,"logistics, supply-chain, segregation, traceability, certification"
Islamic Marketing & Consumer Behavior,Prohibited Financial Practices,"gharar, riba, uncertainty, interest, speculation"
"Corporate Social Responsibility (CSR), Sustainability & Ethics",CSR and Stakeholder Management,"social, impact, stakeholders, community, reporting"
"Corporate Social Responsibility (CSR), Sustainability & Ethics",Corporate Governance and Ethics,"governance, transparency, accountability, board, ethics"
"Corporate Social Responsibility (CSR), Sustainability & Ethics",Environmental Sustainability Metrics,"environmental, footprint, circular, economy, climate"
"Corporate Social Responsibility (CSR), Sustainability & Ethics",ESG Investing and Financial Performance,"esg, investment, finance, performance, risk"
"Corporate Social Responsibility (CSR), Sustainability & Ethics",Sustainable Business Strategy,"sustainability, strategy, innovation, business, model"
"Corporate Social Responsibility (CSR), Sustainability & Ethics",Ethics in Green Marketing,"greenwashing, trust, consumer, reputation, marketing"
Consumer Psychology & Socio-cultural Influences in Emerging Markets,Price Sensitivity and Value,"affordability, value, price, elasticity, budget"
Consumer Psychology & Socio-cultural Influences in Emerging Markets,Socio-cultural Factors,"cultural, tradition, norms, societal, values"
Consumer Psychology & Socio-cultural Influences in Emerging Markets,Product Localization Strategy,"local, adaptation, customization, preferences, market"
Consumer Psychology & Socio-cultural Influences in Emerging Markets,Social Influence on Buying,"family, social, influence, roles, status"
Consumer Psychology & Socio-cultural Influences in Emerging Markets,Digital Commerce Adoption,"digital, infrastructure, e-commerce, mobile, adoption"
Consumer Psychology & Socio-cultural Influences in Emerging Markets,Brand Trust and Loyalty,"trust, brand, loyalty, reputation, relationships"
Consumer Psychology & Socio-cultural Influences in Emerging Markets,Aspirational Consumption Drivers,"aspirational, status, prestige, power, image"
"Sustainable Marketing, Environmental Behavior & Mobility",Sustainable Consumer Behavior,"green, consumption, purchasing, eco-friendly, consumer"
"Sustainable Marketing, Environmental Behavior & Mobility",Green Marketing Strategy,"marketing, sustainability, strategy, communication, value"
"Sustainable Marketing, Environmental Behavior & Mobility",Sustainable Mobility Adoption,"transportation, mobility, electric, shared, behavior"
"Sustainable Marketing, Environmental Behavior & Mobility",Marketing in Circular Economy,"circular, economy, product, lifecycle, design"
"Sustainable Marketing, Environmental Behavior & Mobility",CSR and Brand Perception,"corporate, social, responsibility, ethics, brand"
"Sustainable Marketing, Environmental Behavior & Mobility",Environmental Behavior Determinants,"attitude, intention, environmental, concern, psychology"
"Sustainable Marketing, Environmental Behavior & Mobility",Policy Impact on Sustainability,"policy, regulation, government, incentive, promotion"
Digital & AI-Driven Marketing,Hyper-Personalized Customer Experience,"personalization, customer, journey, segmentation, experience"
Digital & AI-Driven Marketing,Marketing Automation Strategies,"automation, marketing, workflow, campaigns, efficiency"
Digital & AI-Driven Marketing,Generative AI in Content,"generative, content, creation, copywriting, insights"
Digital & AI-Driven Marketing,AI-Driven Data Analytics,"data, analytics, modeling, prediction, management"
Digital & AI-Driven Marketing,Ethical AI in Marketing,"algorithms, bias, fairness, ethics, transparency"
Digital & AI-Driven Marketing,AI for SEO Optimization,"search, engine, seo, ranking, optimization"
Digital & AI-Driven Marketing,Marketing Performance Measurement,"roi, attribution, performance, metrics, budget"
Supply Chain Management & Operations Research,Logistics and Distribution Planning,"logistics, transportation, distribution, warehousing, shipping"
Supply Chain Management & Operations Research,Demand Forecasting and Planning,"forecasting, demand, planning, analytics, prediction"
Supply Chain Management & Operations Research,Strategic Sourcing & Procurement,"sourcing, procurement, vendor, supplier, strategic"
Supply Chain Management & Operations Research,Supply Chain Network Design,"network, design, facility, location, planning"
Supply Chain Management & Operations Research,Supply Chain Risk Resilience,"resilience, risk, disruption, mitigation, management"
Sustainable Supply Chain Management & Environmental Operations,Circular Economy & Reverse Logistics,"reverse, logistics, circular, waste, recovery"
Sustainable Supply Chain Management & Environmental Operations,Carbon Footprint Management,"carbon, footprint, emissions, ghg, decarbonization"
Sustainable Supply Chain Management & Environmental Operations,Ethical and Transparent Sourcing,"sourcing, ethical, labor, transparency, traceability"
Sustainable Supply Chain Management & Environmental Operations,Sustainable Supplier Performance,"supplier, assessment, monitoring, compliance, performance"
Sustainable Supply Chain Management & Environmental Operations,Product Life Cycle Assessment,"design, ecodesign, lifecycle, packaging, materials"
Sustainable Supply Chain Management & Environmental Operations,Digital Enablers for Sustainability,"technology, blockchain, iot, analytics, digital"
Sustainable Supply Chain Management & Environmental Operations,Supply Chain Sustainability Risk,"risk, resilience, disruption, vulnerability, adaptation"
Blockchain Technology in Supply Chain Transformation,Supply Chain Visibility and Trust,"transparency, traceability, ledger, immutable, trust"
Blockchain Technology in Supply Chain Transformation,Automating Supply Chain Contracts,"smart, contracts, automation, execution, decentralized"
Blockchain Technology in Supply Chain Transformation,Security and Data Integrity,"decentralization, security, data, integrity, privacy"
Blockchain Technology in Supply Chain Transformation,Supply Chain Risk Management,"risk, management, resilience, disruption, mitigation"
Blockchain Technology in Supply Chain Transformation,Sustainable and Ethical Supply Chains,"sustainability, esg, ethical, compliance, circular"
Blockchain Technology in Supply Chain Transformation,Blockchain Implementation Challenges,"interoperability, adoption, integration, scalability, enterprise"
Public Service Management & Service Quality,Citizen Service Evaluation,"citizen, perception, expectations, satisfaction, evaluation"
Public Service Management & Service Quality,Public Sector Governance & Reform,"governance, reform, accountability, transparency, bureaucracy"
Public Service Management & Service Quality,Public Employee Management,"motivation, employee, attitudes, leadership, management"
Public Service Management & Service Quality,Administrative Policy & Regulation,"policy, analysis, making, regulation, law"
Public Service Management & Service Quality,Digital Public Service Innovation,"digital, e-government, technology, innovation, transformation"
Financial Risk & Asset Pricing,Capital Asset Pricing Model,"capm, beta, return, risk, market"
Financial Risk & Asset Pricing,Factor Pricing Models,"factors, fama, french, anomaly, momentum"
Financial Risk & Asset Pricing,Derivative Pricing and Hedging,"derivative, option, pricing, garch, hedging"
Financial Risk & Asset Pricing,Risk Premium Estimation,"risk, premium, equity, default, sovereign"
Financial Risk & Asset Pricing,Fixed Income Pricing,"interest, rate, curve, yield, bonds"
"ESG (Environmental, Social, Governance) and Corporate Resilience",Environmental Risk and Reporting,"emissions, climate, carbon, risk, reporting"
"ESG (Environmental, Social, Governance) and Corporate Resilience",Social Equity and Stakeholders,"diversity, equity, inclusion, labor, stakeholders"
"ESG (Environmental, Social, Governance) and Corporate Resilience",Corporate Governance and Ethics,"governance, board, ethics, transparency, accountability"
"ESG (Environmental, Social, Governance) and Corporate Resilience",Sustainable Supply Chain,"supply, chain, circularity, waste, management"
Crisis & Pandemic Management in Business Contexts,Supply Chain Resilience,"supply, chain, disruption, resilience, logistics"
Crisis & Pandemic Management in Business Contexts,Financial Crisis Management,"financial, liquidity, forecasting, recovery, stimulus"
Crisis & Pandemic Management in Business Contexts,Employee Health and Safety,"employee, wellbeing, health, safety, retention"
Crisis & Pandemic Management in Business Contexts,Digital Transformation Agility,"digital, transformation, innovation, technology, agility"
Crisis & Pandemic Management in Business Contexts,Business Continuity Planning,"risk, assessment, planning, mitigation, preparedness"
Digital & Interactive Marketing,Search Engine Optimization,"seo, traffic, ranking, keywords, search"
Digital & Interactive Marketing,Social Media Marketing Strategy,"social, media, engagement, platforms, influencers"
Digital & Interactive Marketing,Conversion Rate Optimization,"conversion, rate, optimization, landing, a/b"
Digital & Interactive Marketing,Personalized Customer Experience,"personalization, customer, experience, data, retargeting"
Digital & Interactive Marketing,Email Marketing Automation,"email, automation, campaigns, segmentation, nurturing"
Digital & Interactive Marketing,Paid Digital Advertising,"advertising, paid, clicks, ppc, display"
Digital & Interactive Marketing,Digital Marketing Analytics,"analytics, metrics, roi, performance, measurement"
Artificial Intelligence & Emerging Technologies in Marketing,Personalized Customer Journeys,"personalization, customer, journey, recommendation, intent"
Artificial Intelligence & Emerging Technologies in Marketing,Generative AI for Content,"generative, content, creation, automation, copywriting"
Artificial Intelligence & Emerging Technologies in Marketing,Programmatic Ad Optimization,"programmatic, bidding, advertising, targeting, optimization"
Artificial Intelligence & Emerging Technologies in Marketing,Marketing Data Analytics,"data, analytics, churn, conversion, patterns"
