research_field,topic_label,topic_words
Artificial Intelligence,Natural Language Processing,"natural, language, processing, text, understanding"
Artificial Intelligence,Reinforcement Learning Agents,"reinforcement, agent, environment, reward, policy"
Artificial Intelligence,AI Ethics and Fairness,"data, bias, fairness, ethics, transparency"
Artificial Intelligence,Knowledge Representation & Logic,"knowledge, representation, reasoning, ontology, logic"
Knowledge Representation,Formal Ontology and Logic,"ontology, logic, semantics, description, reasoning"
Knowledge Representation,Nonmonotonic Reasoning Systems,"nonmonotonic, defeasibility, belief, revision, default"
Knowledge Representation,Structured Representation Formalisms,"rules, production, frames, networks, semantic"
Knowledge Representation,Agent Knowledge and Reasoning,"agent, architecture, intelligent, belief, intention"
Knowledge Representation,Explainable Knowledge Representation,"explainable, interpretability, transparency, symbolic, justification"
Non-Monotonic Reasoning,Default Logic and Uncertainty,"defeasibility, logic, inference, default, uncertainty"
Non-Monotonic Reasoning,First-Order Circumscription,"circumscription, minimization, predicate, abnormal, models"
Non-Monotonic Reasoning,Autoepistemic Logic,"autoepistemic, belief, knowledge, extensions, stable"
Non-Monotonic Reasoning,Abductive Reasoning Formalisms,"abduction, explanation, hypothesis, diagnostics, evidence"
Non-Monotonic Reasoning,Belief Revision and Change,"revision, change, contraction, expansion, theory"
Non-Monotonic Reasoning,Abstract Argumentation Frameworks,"argumentation, semantics, frameworks, attack, justification"
Explainable AI,Post-hoc Explainability Methods,"post-hoc, lime, shap, explanation, approximation"
Explainable AI,Ethical AI and Trust,"fairness, bias, accountability, ethics, trust"
Explainable AI,Causal and Counterfactual Explanations,"counterfactual, recourse, causal, what-if, influence"
Explainable AI,Human-Centered XAI,"human, user, interface, evaluation, cognition"
Explainable AI,Visual Explanation Techniques,"visual, heatmap, saliency, attention, visualization"
Commonsense Reasoning,Inference in Commonsense,"inference, nonmonotonic, logic, deduction, abduction"
Commonsense Reasoning,Temporal and Causal Reasoning,"time, causality, actions, events, planning"
Commonsense Reasoning,Mental State Reasoning,"beliefs, desires, intentions, emotions, theory"
Commonsense Reasoning,Data and Benchmarking,"crowdsourcing, human, labeling, evaluation, benchmarks"
Logic and Ontology,First-Order Logic Foundations,"first-order, quantifiers, predicates, logic, semantics"
Logic and Ontology,Knowledge Representation and Inference,"knowledge, representation, reasoning, inference, axioms"
Logic and Ontology,Description Logic Modeling,"classes, roles, individuals, dl, description"
Logic and Ontology,Ontologies for Semantic Web,"semantic, web, owl, rdf, alignment"
Logic and Ontology,Non-Classical and Modal Logics,"modal, temporal, non-monotonic, default, belief"
Logic and Ontology,Automated Reasoning and Proof,"automated, theorem, proving, resolution, unification"
Logic and Ontology,Logic-Based Knowledge Graphs,"graph, data, schema, linked, triple"
Neuro-Symbolic AI,Neuro-Symbolic Integration,"neural, symbolic, integration, knowledge, logic"
Neuro-Symbolic AI,Automated Reasoning & Planning,"reasoning, automatic, planning, constraints, consistency"
Neuro-Symbolic AI,Knowledge Representation,"representation, graph, ontology, facts, rules"
Neuro-Symbolic AI,Explainable Neuro-Symbolic AI,"explainable, interpretability, trust, transparency, insights"
Neuro-Symbolic AI,Differentiable Logic Programming,"program, synthesis, logic, programming, differentiable"
Neuro-Symbolic AI,Neuro-Symbolic Applications,"commonsense, robotics, nlp, vision, application"
Explainable AI,Foundational XAI Concepts,"interpretability, transparency, trust, fidelity, auditability"
Explainable AI,Model-Agnostic Explainers,"lime, shap, agnostic, local, importance"
Explainable AI,Feature Importance & Visualization,"features, relevance, attribution, heatmaps, visualization"
Explainable AI,Responsible AI and XAI,"responsible, fairness, bias, governance, ethics"
Explainable AI,Causal and Contrastive Explanations,"causality, counterfactual, systems, why, what-if"
Explainable AI,Inherently Interpretable Models,"rules, trees, linear, logic, inherent"
Generative AI,Generative Adversarial Networks,"gan, adversarial, generator, discriminator, network"
Generative AI,Transformer-based Models,"transformer, attention, sequence, language, modeling"
Generative AI,Text-to-Image Generation,"text, image, synthesis, multimodal, generation"
Generative AI,Controlled Content Generation,"prompt, engineering, control, conditioning, inputs"
Generative AI,Generative AI Ethics,"ethical, bias, safety, alignment, responsible"
Knowledge Representation & Reasoning,Ontological Knowledge Representation,"ontology, logic, semantics, description, inference"
Knowledge Representation & Reasoning,Nonmonotonic Logic and Belief Revision,"nonmonotonic, defeasible, revision, belief, update"
Knowledge Representation & Reasoning,Commonsense and Qualitative Reasoning,"commonsense, knowledgebase, concept, context, qualitative"
Knowledge Representation & Reasoning,Knowledge Graphs and Semantic Networks,"graph, semantic, network, frame, relationships"
Knowledge Representation & Reasoning,Logic Programming and Deduction,"logic, programming, prolog, rule, deductive"
Knowledge Representation & Reasoning,Automated Reasoning and Theorem Proving,"automated, theorem, proving, satisfiability, solver"
Knowledge Representation & Reasoning,Neuro-Symbolic Integration,"neurosymbolic, integration, neural, logic, hybrid"
Machine Learning,Deep Learning Optimization,"gradient, loss, backpropagation, weights, optimization"
Machine Learning,Reinforcement Learning Agents,"reinforcement, agent, environment, reward, policy"
Machine Learning,Unsupervised Learning Techniques,"unsupervised, clustering, dimensionality, reduction, manifold"
Machine Learning,Ethical AI and Fairness,"dataset, bias, fairness, interpretability, ethics"
Machine Learning,Convolutional Neural Networks,"convolutional, neural, image, vision, recognition"
Machine Learning,Attention Mechanisms in NLP,"transformer, attention, sequence, nlp, language"
Machine Learning,Tree-Based Ensemble Methods,"trees, ensemble, boosting, random, forest"
Face Recognition,Facial Detection and Alignment,"detection, tracking, alignment, localization, features"
Face Recognition,Deep Learning for Recognition,"deep, convolutional, network, learning, embeddings"
Face Recognition,Robustness to Face Variations,"illumination, pose, occlusion, robustness, variations"
Face Recognition,Age-Invariant Recognition,"age, invariance, cross-age, aging, progression"
Face Recognition,Facial Expression and Emotion,"expression, emotion, analysis, behavioral, dynamic"
Face Recognition,Biometric Security and Liveness,"biometric, verification, identification, liveness, spoofing"
Pattern Recognition,Supervised Pattern Classification,"classification, features, training, testing, model"
Pattern Recognition,Unsupervised Data Clustering,"clustering, unsupervised, similarity, distance, groups"
Pattern Recognition,Deep Learning Techniques,"deep, networks, convolutional, recurrent, learning"
Pattern Recognition,Visual Pattern Recognition,"image, pixels, segmentation, object, detection"
Pattern Recognition,Acoustic Pattern Analysis,"speech, audio, voice, recognition, signal"
Pattern Recognition,Temporal Sequence Mining,"sequential, temporal, series, dynamics, prediction"
Pattern Recognition,Feature Engineering & Reduction,"feature, extraction, selection, dimensionality, reduction"
Signal Processing,Digital Signal Processing Fundamentals,"digital, sampling, quantization, filtering, transforms"
Signal Processing,Audio & Speech Signal Processing,"audio, speech, acoustic, music, compression"
Signal Processing,Image and Video Processing,"image, video, processing, segmentation, computer"
Signal Processing,Wireless Communications Signal Processing,"wireless, communication, channel, mimo, waveform"
Signal Processing,Time-Frequency Spectral Analysis,"time, frequency, analysis, spectral, estimation"
Signal Processing,Signal Processing via AI/ML,"machine, learning, deep, neural, algorithms"
Signal Processing,Sensor Array Signal Processing,"sensor, array, radar, detection, estimation"
Artificial Intelligence,Deep Neural Networks,"neural, networks, deep, learning, model"
Artificial Intelligence,Reinforcement Learning Agents,"reinforcement, agent, reward, policy, environment"
Artificial Intelligence,Natural Language Processing,"language, natural, processing, semantics, text"
Artificial Intelligence,Image Recognition & Vision,"computer, vision, image, detection, recognition"
Artificial Intelligence,Knowledge Representation Logic,"logic, knowledge, reasoning, representation, ontology"
Artificial Intelligence,Explainable AI (XAI),"explainable, interpretability, transparency, xai, feature"
Cognitive Science,Human Memory Processes,"memory, encoding, retrieval, working, long-term"
Cognitive Science,Sensory Perception and Processing,"perception, sensory, processing, visual, auditory"
Cognitive Science,Language and Communication,"language, comprehension, production, linguistics, semantics"
Cognitive Science,Decision Making and Judgment,"decision, making, rationality, heuristics, judgment"
Cognitive Science,Attention and Cognitive Control,"attention, selective, sustained, executive, control"
Cognitive Science,Problem Solving and Reasoning,"problem, solving, reasoning, logic, deduction"
Cognitive Science,Computational Neuroscience Modeling,"neural, networks, computation, brain, modeling"
Agentic AI,Multi-Agent Systems,"agent, multiagent, coordination, negotiation, interaction"
Agentic AI,Autonomous Agent Planning,"planning, reasoning, goal, environment, deliberation"
Agentic AI,Responsible Agentic AI,"safety, alignment, ethics, governance, responsible"
Agentic AI,LLM-Powered Agents,"llm, tool, memory, orchestration, chaining"
Agentic AI,Agent Learning & Adaptation,"learning, adaptation, reinforcement, evolution, self-improving"
Agentic AI,Human-Agent Interaction,"human-agent, collaboration, trust, interface, teaming"
Agentic AI,Agentic Problem Solving,"exploration, search, problem, solving, action"
Analogical Reasoning,Structural Mapping and Transfer,"mapping, structure, relations, similarity, transfer"
Analogical Reasoning,Analogical Problem Solving,"problem, solving, retrieval, source, target"
Analogical Reasoning,Metaphor and Conceptual Analogy,"metaphor, conceptual, language, figurative, creativity"
Analogical Reasoning,Analogical AI Systems,"ai, reasoning, models, computational, systems"
Analogical Reasoning,Justification of Analogical Reasoning,"justification, induction, deduction, argument, epistemology"
Analogical Reasoning,Analogy in Scientific Discovery,"scientific, discovery, model, hypothesis, innovation"
Sketch recognition,Digital Ink Processing,"digital, ink, strokes, segmentation, gestures"
Sketch recognition,Template-Based Recognition,"template, matching, primitive, feature, geometric"
Sketch recognition,Model Evaluation & Training,"classifier, training, accuracy, model, dataset"
Sketch recognition,Interactive Sketch Interfaces,"haptics, interaction, user, interface, multimodal"
Sketch recognition,Semantic Sketch Interpretation,"semantics, understanding, concept, context, domain"
Sketch recognition,Sketch-Based Image Retrieval,"retrieval, search, query, image, content"
LoRa modulation and performance analysis,Chirp Spread Spectrum,"chirp, spread, spectrum, css, bandwidth"
LoRa modulation and performance analysis,Spreading Factor Optimization,"spreading, factor, datarate, range, tradeoff"
LoRa modulation and performance analysis,Interference and Coexistence,"interference, coexistence, collision, duty-cycle, throughput"
LoRa modulation and performance analysis,Bit Error Rate Analysis,"ber, snr, fading, channel, analysis"
LoRa modulation and performance analysis,LoRaWAN Protocol Performance,"lorawan, mac, network, gateway, end-device"
LoRa modulation and performance analysis,Energy Efficiency in LoRa,"energy, battery, power, consumption, efficiency"
Wireless sensor networks,Energy Efficient WSNs,"energy, efficiency, lifetime, power, management"
Wireless sensor networks,Sensor Node Localization,"localization, node, positioning, tracking, geographical"
Wireless sensor networks,WSN Security and Trust,"security, intrusion, encryption, threat, detection"
Wireless sensor networks,In-Network Data Processing,"data, aggregation, compression, processing, storage"
Wireless sensor networks,Quality of Service,"quality, service, qos, latency, reliability"
Wireless sensor networks,MAC Layer Scheduling,"mac, scheduling, access, collision, medium"
IoT communications,Standard IoT Protocols,"protocol, mqtt, coap, lorawan, http"
IoT communications,IoT Security and Privacy,"security, privacy, authentication, encryption, trust"
IoT communications,Low-Power Wide Area Networks,"low-power, lpwan, energy, efficiency, battery"
IoT communications,IoT Resource Management,"network, resource, allocation, optimization, management"
IoT communications,Edge and Fog Computing,"edge, fog, computing, processing, offloading"
IoT communications,Wireless Sensor Networking,"wireless, sensor, m2m, devices, connectivity"
Energy-efficient communications,Low-Power IoT Communication,"lpwan, iot, low-power, sensor, battery"
Energy-efficient communications,MAC Layer Efficiency Protocols,"mac, protocol, sleep, wakeup, duty-cycle"
Energy-efficient communications,Wireless Resource Optimization,"resource, allocation, scheduling, power, optimization"
Energy-efficient communications,Data Center Energy Reduction,"hvac, cooling, data, centers, consumption"
Energy-efficient communications,AI for Energy Management,"ai, machine, learning, predictive, management"
Energy-efficient communications,Smart Grid Energy Efficiency,"smart, grid, demand, response, utility"
Resource Allocation,Cloud Resource Management,"cloud, storage, computing, cpu, bandwidth"
Resource Allocation,Project Resource Planning,"project, management, capacity, planning, workload"
Resource Allocation,Energy-Efficient Resource Use,"energy, power, consumption, green, sustainability"
Cloud/edge/offloading in wireless/mobile networks,Mobile Edge Computation Offloading,"offloading, computation, edge, mobile, latency"
Cloud/edge/offloading in wireless/mobile networks,Wireless Resource Allocation Optimization,"resource, allocation, scheduling, wireless, optimization"
Cloud/edge/offloading in wireless/mobile networks,Hierarchical Edge-Cloud Architectures,"cloud, fog, edge, hierarchy, deployment"
Cloud/edge/offloading in wireless/mobile networks,Content Caching at the Edge,"caching, content, distribution, prefetching, edge"
Cloud/edge/offloading in wireless/mobile networks,Federated Learning in Edge Networks,"learning, federated, edge, distributed, training"
Cloud/edge/offloading in wireless/mobile networks,Security and Privacy in Edge Computing,"security, privacy, authentication, trust, data"
Image Encryption,Chaos-Based Image Encryption,"scrambling, diffusion, permutation, pixel, confusion"
Image Encryption,Conventional Encryption Algorithms,"stream, block, cipher, aes, des"
Image Encryption,Transform Domain Encryption,"transform, wavelet, fourier, domain, dct"
Image Encryption,Image Security Analysis,"security, analysis, histogram, entropy, correlation"
Image Encryption,AI in Image Cryptography,"neural, convolutional, network, deep, machine"
Image Encryption,DNA-Based Image Cryptography,"dna, rna, nucleotides, sequence, biological"
Image Encryption,Encrypted Image Compression,"compression, lossless, jpeg, data, efficiency"
Digital Signal Processing,Frequency Domain Analysis,"fft, dft, transform, frequency, analysis"
Digital Signal Processing,Digital Filter Design,"convolution, filter, impulse, response, design"
Digital Signal Processing,Signal Conversion Principles,"sampling, quantization, aliasing, reconstruction, theorem"
Digital Signal Processing,Wavelet Signal Processing,"wavelet, decomposition, multiresolution, compression, denoising"
Digital Signal Processing,Audio Signal Processing,"speech, audio, voice, recognition, enhancement"
Digital Signal Processing,Spectral Estimation Methods,"estimation, spectral, power, density, periodogram"
Digital Communications,Digital Modulation Techniques,"modulation, demodulation, carrier, symbol, techniques"
Digital Communications,Channel Coding & Error Control,"channel, coding, error, detection, correction"
Digital Communications,Multiple Access and Sharing,"multiplexing, access, multiple, frequency, division"
Digital Communications,Wireless Communication Networks,"networks, wireless, cellular, protocols, standards"
Digital Communications,Digital Signal Processing,"signal, processing, digital, sampling, filter"
Digital Communications,Information Theory Principles,"information, theory, entropy, capacity, shannon"
Digital Communications,Channel Impairments and Performance,"fading, interference, noise, channel, performance"
Cellular Mobile Communications,Next-Generation Cellular Networks,"5g, beyond, latency, massive, mimo"
Cellular Mobile Communications,Dynamic Spectrum Management,"spectrum, sensing, cognitive, dynamic, allocation"
Cellular Mobile Communications,IoT and Wireless Sensor Networks,"internet, iot, sensor, energy, network"
Cellular Mobile Communications,Mobile Edge Computing,"edge, computing, mobile, offloading, distributed"
Cellular Mobile Communications,Mobile Network Security,"security, blockchain, framework, threat, encryption"
Cellular Mobile Communications,Resource Allocation Optimization,"resource, optimization, scheduling, power, allocation"
Cellular Mobile Communications,Vehicular Communications (V2X),"vehicle, v2x, d2d, communication, vehicular"
Wireless communications systems,Massive MIMO Systems,"mimo, massive, channel, precoding, diversity"
Wireless communications systems,Cognitive Radio Spectrum Management,"spectrum, cognitive, resource, allocation, interference"
Wireless communications systems,Next-Generation Mobile Networks,"5g, 6g, networks, future, broadband"
Wireless communications systems,Physical Layer Security,"security, encryption, privacy, physical, authentication"
Wireless communications systems,Wireless Channel Modeling,"channel, estimation, equalization, propagation, modeling"
Wireless communications systems,IoT Sensor Networks,"iot, sensor, low-power, lpwan, connectivity"
Wireless communications systems,Advanced Modulation and Coding,"modulation, coding, ofdm, techniques, performance"
Channel Estimation,MIMO-OFDM Channel Modeling,"mimo, ofdm, wireless, systems, multipath"
Channel Estimation,LS Channel Estimation Techniques,"least, squares, estimation, pilot-based, performance"
Channel Estimation,MMSE Estimation Algorithms,"mmse, minimization, error, linear, adaptive"
Channel Estimation,Deep Learning Channel Estimation,"deep, learning, neural, networks, data-driven"
Channel Estimation,Sparse Channel Estimation,"compressed, sensing, sparse, channel, recovery"
Channel Estimation,Blind Channel Estimation Methods,"blind, subspace, hos-based, conventional, data"
Channel Estimation,Massive MIMO Channel Estimation,"massive, hybrid, millimeter-wave, beamforming, 5g"
MIMO Systems,Massive MIMO Beamforming,"antenna, massive, beamforming, arrays, spatial"
MIMO Systems,Channel Estimation Challenges,"channel, estimation, feedback, aging, delay"
MIMO Systems,Efficiency Optimization in MIMO,"spectral, energy, efficiency, performance, optimization"
MIMO Systems,Multi-User Interference Mitigation,"multi-user, interference, mitigation, detection, scheduling"
MIMO Systems,Adaptive Precoding Techniques,"precoding, adaptive, matrix, downlink, uplink"
MIMO Systems,MmWave MIMO Systems,"millimeter, wave, frequency, propagation, band"
MIMO Systems,Reconfigurable Intelligent Surfaces,"ris, intelligent, surfaces, reflecting, reconfigurable"
Cooperative Relaying,Cooperative Diversity Techniques,"diversity, spatial, fading, channel, combine"
Cooperative Relaying,Optimal Relay Selection Schemes,"selection, best, protocol, performance, outage"
Cooperative Relaying,Amplify-and-Forward Protocols,"amplify, forward, decode, protocol, information"
Cooperative Relaying,Cooperative NOMA Networks,"noma, access, multiple, interference, power"
Cooperative Relaying,Resource Allocation Optimization,"resource, allocation, power, spectrum, optimization"
Cooperative Relaying,Secure Cooperative Communication,"secure, secrecy, jamming, eavesdropper, physical"
Cooperative Relaying,Practical Cooperative Systems,"synchronization, distributed, network, asynchronous, practical"
NOMA Networks,NOMA Resource Allocation,"power, allocation, user, grouping, optimization"
NOMA Networks,Successive Interference Cancellation,"successive, interference, cancellation, sic, receiver"
NOMA Networks,NOMA Performance Enhancement,"spectral, efficiency, massive, connectivity, performance"
NOMA Networks,NOMA Multiple Access Schemes,"power-domain, code-domain, scma, pdma, techniques"
NOMA Networks,Channel State Information,"channel, estimation, csi, fading, modeling"
NOMA Networks,AI for NOMA Optimization,"deep, learning, ai, machine, optimization"
NOMA Networks,Advanced NOMA System Architectures,"cooperative, relaying, ris, mimo, systems"
RIS Technology,Intelligent Reflecting Surfaces,"reconfigurable, surface, intelligent, reflection, metasurface"
RIS Technology,RIS Channel Optimization,"channel, estimation, passive, phase, optimization"
RIS Technology,Passive Beamforming Arrays,"beamforming, passive, array, gain, direction"
RIS Technology,RIS in Wireless Communications,"wireless, communications, mimo, noma, coverage"
RIS Technology,Energy Efficient RIS,"energy, efficiency, harvesting, low-power, consumption"
RIS Technology,Physical Layer Security,"security, privacy, physical-layer, eavesdropping, encryption"
RIS Technology,AI-Driven RIS Control,"reinforcement, learning, ai, control, deep"
Power Optimization,Energy Consumption Efficiency,"consumption, efficiency, reduction, management, system"
Power Optimization,Optimization Algorithms & Modeling,"algorithms, mathematical, linear, nonlinear, constraints"
Power Optimization,Wireless Network Power Allocation,"wireless, transmission, resource, allocation, network"
Power Optimization,AI for Power Optimization,"machine, learning, predictive, forecasting, adaptive"
Full-Duplex Systems,Self-Interference Cancellation Techniques,"self-interference, cancellation, analog, digital, mitigation"
Full-Duplex Systems,Simultaneous Bidirectional Wireless Communication,"duplex, transmission, simultaneous, bidirectional, wireless"
Full-Duplex Systems,MIMO Full-Duplex Systems,"mimo, networks, beamforming, massive, spatial"
Full-Duplex Systems,Full-Duplex Performance Metrics,"throughput, efficiency, spectrum, data, rate"
Full-Duplex Systems,Full-Duplex Hardware Implementation,"hardware, circuit, integrated, rf, design"
Full-Duplex Systems,Channel Estimation and Modeling,"channel, estimation, modeling, equalization, propagation"
Radio Frequency,Antenna Design and Arrays,"antenna, design, radiation, impedance, array"
Radio Frequency,Microwave and mmWave Circuits,"microwave, frequency, millimeterwave, circuits, waveguide"
Radio Frequency,Radio Wave Propagation,"propagation, channel, fading, electromagnetic, pathloss"
Radio Frequency,RF Transceiver Systems,"transmitter, receiver, transceiver, modulation, system"
Radio Frequency,RF Circuit Components,"lna, mixer, amplifier, oscillator, filter"
Radio Frequency,RF Power Amplifiers,"power, linearity, efficiency, amplifier, consumption"
Radio Frequency,RF Characterization and Modeling,"s-parameters, matching, network, measurement, simulation"
Microwave Technology,Antenna and Array Design,"antenna, array, matching, feed, phased"
Microwave Technology,Passive Component Modeling,"filter, coupler, splitter, waveguide, resonator"
Microwave Technology,Active Circuit Design,"amplifier, oscillator, mixer, noise, gain"
Microwave Technology,Microwave Sensing Systems,"radar, sensing, detection, imaging, system"
Microwave Technology,Transmission Line Theory,"transmission, line, impedance, microstrip, s-parameters"
Microwave Technology,Signal Processing Techniques,"fourier, time, frequency, signal, spectrum"
Microwave Technology,High-Power Microwave Devices,"power, device, semiconductor, gallium, nitride"
Antenna Design,Microstrip Patch Antennas,"microstrip, patch, substrate, radiation, impedance"
Antenna Design,Antenna Arrays and MIMO,"array, mimo, beamforming, phased, coupling"
Antenna Design,Ultrawideband Antenna Systems,"ultrawideband, frequency, bandwidth, impulse, time"
Antenna Design,Wearable and Implantable Antennas,"wearable, implantable, flexible, medical, body"
Antenna Design,Metamaterial-Based Antenna Structures,"metamaterial, structure, composite, negative, refractive"
Antenna Design,Reconfigurable Antenna Design,"reconfigurable, tuning, switch, p-i-n, frequency"
Radio Frequency,Antenna Theory and Design,"antenna, array, design, radiation, impedance"
Radio Frequency,RF and Microwave Circuits,"microwave, millimeterwave, circuits, passive, active"
Radio Frequency,RF Signal Propagation,"signal, propagation, channel, fading, electromagnetic"
Radio Frequency,RF Power Amplifiers,"amplifier, power, linearization, efficiency, wideband"
Radio Frequency,RF Filtering and Components,"filter, duplexer, frequency, selectivity, resonator"
Radio Frequency,Wireless RF Systems,"wireless, communication, systems, receiver, transmitter"
Radio Frequency,RF Sensing and Radar,"sensing, radar, imaging, remote, detection"
Microwave Technology,Antenna Array Beamforming,"antenna, array, phased, beamforming, gain"
Microwave Technology,Microwave Circuit Components,"circuits, devices, passive, active, components"
