research_field,topic_label,topic_words
Microwave Technology,High-Efficiency Power Amplifiers,"power, amplifier, doherty, efficiency, linearity"
Microwave Technology,Wireless Communication Systems,"wireless, communication, systems, 5g, satellite"
Microwave Technology,Substrate Integrated Waveguide Components,"waveguide, substrate, integrated, filter, coupler"
Microwave Technology,Radar System Design,"radar, systems, duplexer, transmitter, receiver"
Microwave Technology,Metamaterials and Modeling,"metamaterial, electromagnetic, characterization, modeling, simulation"
Antenna Design,Phased Array Beam Steering,"phased, array, beamforming, scanning, elements"
Antenna Design,Microstrip Patch Antenna,"microstrip, patch, substrate, fed, resonant"
Antenna Design,Dielectric Resonator Antennas,"dielectric, resonator, modes, radiation, efficiency"
Antenna Design,Metamaterial Antenna Structures,"metamaterial, unit, cell, surface, negative"
Antenna Design,Multiband Antenna Systems,"multiband, wideband, frequency, reconfigurable, tuning"
Antenna Design,MIMO Antenna Design,"mimo, multiple, channel, correlation, capacity"
Network Resource Optimization,Network Performance Metrics,"bandwidth, throughput, latency, congestion, qos"
Network Resource Optimization,Resource Allocation Mechanisms,"allocation, scheduling, fairness, optimization, capacity"
Network Resource Optimization,AI for Network Optimization,"machine, learning, reinforcement, predictive, automation"
Network Resource Optimization,Energy-Efficient Networking,"energy, consumption, efficiency, green, sustainable"
Network Resource Optimization,Edge Computing Resource Allocation,"edge, cloud, offloading, computing, mobile"
Network Resource Optimization,Intelligent Traffic Management,"traffic, engineering, routing, load, balancing"
Wireless Networking,Next-Generation Wireless Networks,"five-g, six-g, massive, mimo, cell"
Wireless Networking,IoT Sensor Networks,"iot, sensor, low-power, lpwan, connectivity"
Wireless Networking,Network Resource Optimization,"resource, allocation, scheduling, optimization, spectrum"
Wireless Networking,Mobile Edge Computing,"mobile, edge, computing, caching, offloading"
Wireless Networking,Wireless Network Security,"security, privacy, authentication, encryption, threats"
Wireless Networking,Ad-Hoc and Mesh Networks,"mesh, ad-hoc, routing, protocol, architecture"
Mobile Edge Computing,Computation Offloading Strategies,"offloading, computation, task, delay, resource"
Mobile Edge Computing,Mobile User Mobility Management,"mobility, handover, tracking, user, management"
Mobile Edge Computing,Edge Computing for IoT,"iot, sensor, data, processing, network"
Mobile Edge Computing,Edge Security and Privacy,"security, privacy, authentication, encryption, trust"
Mobile Edge Computing,Content Caching and Delivery,"caching, content, distribution, storage, delivery"
Mobile Edge Computing,Network Performance Optimization,"latency, throughput, reliability, performance, optimization"
Mobile Edge Computing,Wireless Resource Allocation,"spectrum, scheduling, allocation, interference, wireless"
Distributed Systems,Fault Tolerance & Consensus,"consistency, fault, replication, paxos, raft"
Distributed Systems,System Scalability & Performance,"concurrency, scalability, latency, throughput, performance"
Distributed Systems,Distributed Communication Protocols,"message, rpc, protocol, inter-process, communication"
Distributed Systems,Resource Management & Allocation,"scheduling, resource, allocation, load, balancing"
Distributed Systems,Security in Distributed Systems,"security, encryption, trust, privacy, access"
Distributed Systems,Modern Distributed Architectures,"serverless, microservices, container, orchestration, cloud"
Linear & Non-Linear Optimization,Linear Programming Methods,"simplex, dual, constraints, feasible, maximization"
Linear & Non-Linear Optimization,Unconstrained Nonlinear Optimization,"gradient, newton, descent, hessian, unconstrained"
Linear & Non-Linear Optimization,Constrained Optimization Conditions,"karush, kuhn, tucker, optimality, constrained"
Linear & Non-Linear Optimization,Nonlinear Optimization Algorithms,"penalty, augmented, lagrangian, barrier, multiplier"
Linear & Non-Linear Optimization,Discrete Optimization,"integer, mixed, branch, bound, combinatorial"
Linear & Non-Linear Optimization,Optimization Step Strategies,"trust, region, linesearch, search, step"
Smart Grid Systems,Grid Reliability and Fault Detection,"detection, self-healing, fault, reliability, estimation"
Smart Grid Systems,Smart Grid Cybersecurity,"security, cyber, protection, privacy, attack"
Smart Grid Systems,Energy Management & Optimization,"optimization, resource, load, energy, management"
Smart Grid Systems,Microgrid Stability and Resilience,"microgrids, islanding, stability, resilience, local"
Energy Management,Demand Response Strategies,"demand, response, load, shedding, pricing"
Energy Management,Renewable Energy Integration,"renewable, integration, grid, stability, forecasting"
Energy Management,Smart Grid Technologies,"smart, grid, communication, infrastructure, metering"
Energy Management,Energy Storage Optimization,"storage, battery, optimization, capacity, scheduling"
Energy Management,Building Energy Efficiency,"building, efficiency, hvac, lighting, insulation"
Energy Management,Energy Performance Analysis,"audits, monitoring, consumption, analysis, baseline"
Energy Management,Microgrid Design & Resilience,"microgrids, resilience, decentralized, reliability, islanding"
Home Energy Optimization,Smart Thermostat Control,"smart, thermostat, hvac, scheduling, control"
Home Energy Optimization,Intelligent Load Management,"load, shifting, appliances, storage, management"
Home Energy Optimization,Home Renewable Energy Systems,"photovoltaic, solar, battery, generation, microgrid"
Home Energy Optimization,Building Envelope Efficiency,"insulation, air, sealing, envelope, efficiency"
Home Energy Optimization,Occupant Behavior and Energy,"behavior, occupancy, awareness, feedback, user"
Home Energy Optimization,Smart Lighting Optimization,"lighting, led, fixtures, dimming, automation"
Advanced materials,Nanomaterials and Synthesis,"nanoparticles, graphene, carbon, synthesis, functionalization"
Advanced materials,Composite Materials Mechanics,"polymer, composite, matrix, fiber, strength"
Advanced materials,Ceramic Processing and Structure,"ceramic, oxide, sintering, structural, porosity"
Advanced materials,Electronic Materials Design,"electronic, semiconductor, device, fabrication, transistor"
Advanced materials,Energy Storage Materials,"battery, storage, electrode, electrolyte, cathode"
Advanced materials,Biomaterials for Tissue Engineering,"scaffold, tissue, regeneration, biocompatibility, implant"
Advanced materials,Computational Materials Science,"computational, modeling, simulation, molecular, density"
composites,Fiber-Matrix Interfacial Science,"fiber, matrix, interfacial, reinforcement, polymer"
composites,Composite Mechanical Properties,"mechanical, tensile, strength, modulus, failure"
composites,Nanocomposite Materials & Fillers,"nanocomposites, carbon, cnts, graphene, filler"
composites,Composite Processing & Manufacturing,"processing, fabrication, curing, laminate, molding"
composites,Damage and Failure Analysis,"damage, fracture, delamination, fatigue, cracking"
composites,Sustainable & Bio-Composites,"bio, natural, recycling, sustainable, cellulose"
materials for solar energy,Perovskite Solar Cells Research,"perovskite, stability, efficiency, structure, halide"
materials for solar energy,Crystalline Silicon PV Technology,"silicon, crystalline, photovoltaic, wafer, cell"
materials for solar energy,Organic Photovoltaic Materials,"polymer, organic, flexible, thin-film, absorber"
materials for solar energy,Compound Semiconductor Thin-Films,"cadmium, telluride, copper, indium, selenide"
Materials for Biomedical Applications,Tissue Engineering Scaffolds,"scaffold, tissue, engineering, regeneration, porosity"
Materials for Biomedical Applications,Controlled Drug Delivery Systems,"drug, delivery, release, controlled, nanoparticle"
Materials for Biomedical Applications,Biomaterial Biocompatibility Assessment,"biocompatibility, host, response, cytotoxicity, surface"
Materials for Biomedical Applications,Orthopedic and Dental Implants,"implant, orthopedic, dental, metallic, ceramic"
Materials for Biomedical Applications,Polymeric Biomaterials,"hydrogel, polymer, alginate, chitosan, biodegradable"
Materials for Biomedical Applications,Biomaterial-based Diagnostics,"biosensor, detection, diagnostic, electrode, sensing"
Materials for Biomedical Applications,Biomaterial Surface Engineering,"surface, modification, coating, functionalization, roughness"
Effect of Processing of Material Properties,Microstructure and Thermal Processing,"microstructure, grain, thermal, phase, kinetics"
Effect of Processing of Material Properties,Processing Influence on Mechanical Properties,"strength, ductility, hardness, fatigue, mechanical"
Effect of Processing of Material Properties,Casting Process Effects,"casting, solidification, fluidity, molding, defects"
Effect of Processing of Material Properties,Metal Forming and Strain Hardening,"forging, rolling, deformation, strain, hardening"
Effect of Processing of Material Properties,Welding and Joining Effects,"welding, residual, stress, distortion, joining"
Effect of Processing of Material Properties,Heat Treatment Processes,"heat, treatment, annealing, quenching, tempering"
Effect of Processing of Material Properties,Additive Manufacturing Parameters,"additive, density, porosity, layer, printing"
materials for solar energy,Perovskite Solar Cell Research,"perovskite, stability, efficiency, degradation, tandem"
materials for solar energy,Crystalline Silicon Materials,"silicon, crystalline, photovoltaic, wafer, junction"
materials for solar energy,Thin-Film Solar Technologies,"thinfilm, amorphous, organic, flexible, deposition"
materials for solar energy,Charge Transport Materials,"charge, transport, layers, extraction, interface"
materials for solar energy,Scalable Material Fabrication,"fabrication, processing, scalable, printing, manufacturing"
materials for solar energy,Solar Material Properties,"absorption, spectrum, bandgap, semiconductor, photons"
materials for solar energy,Material Stability and Reliability,"durability, thermal, moisture, encapsulation, reliability"
Renewable energy,Solar Photovoltaic Energy Systems,"solar, photovoltaic, energy, panel, conversion"
Renewable energy,Wind Energy Conversion Systems,"wind, turbine, farm, power, rotor"
Renewable energy,Sustainable Bioenergy and Biofuels,"bioenergy, biomass, biofuel, sustainable, feedstock"
Renewable energy,Geothermal Energy Resource Extraction,"geothermal, heat, earth, resource, drilling"
Renewable energy,Hydrogen Fuel Cell Technology,"hydrogen, fuel, cell, electrolysis, storage"
Renewable energy,Smart Grid Energy Integration,"grid, smart, storage, integration, optimization"
Renewable energy,Marine Hydrokinetic Energy,"tidal, wave, ocean, hydrokinetic, marine"
solar energy,Photovoltaic Cell Technologies,"photovoltaic, panels, efficiency, silicon, cells"
solar energy,Concentrating Solar Power Systems,"concentrating, thermal, storage, mirror, heat"
solar energy,Solar Grid Integration,"grid, integration, inverter, modeling, stability"
solar energy,Solar Energy Storage,"molten, salt, thermal, duration, battery"
solar energy,Solar Technology Economics,"manufacturing, cost, lifetime, reliability, commercialization"
Computational fluid dynamics,CFD Governing Equations,"navier, stokes, equations, conservation, momentum"
Computational fluid dynamics,Numerical Discretization Methods,"finite, volume, element, difference, discretization"
Computational fluid dynamics,Aerodynamic Flow Analysis,"aerodynamics, aerospace, hypersonics, lift, drag"
Computational fluid dynamics,Fluid Heat Transfer,"heat, transfer, convection, conduction, radiation"
Control Theory,Classical System Analysis,"stability, poles, zeros, feedback, response"
Control Theory,Model Predictive Control,"model, optimization, constraints, receding, horizon"
Control Theory,Nonlinear Control Systems,"nonlinear, lyapunov, feedback, geometric, input-output"
Control Theory,Multi-Agent Networked Control,"multi-agent, networked, consensus, distributed, cooperative"
Control Theory,Optimal Control Theory,"optimal, cost, minimization, dynamic, calculus"
Control Theory,Stochastic Control and Filtering,"stochastic, kalman, noise, probability, uncertainty"
Embedded Systems,Real-Time Operating Systems,"real-time, scheduling, rtos, deadlines, latency"
Embedded Systems,Microcontroller Firmware Development,"microcontroller, firmware, hardware, peripheral, programming"
Embedded Systems,Low-Power Embedded Design,"low-power, energy, battery, optimization, efficiency"
Embedded Systems,Sensor and Actuator Interfacing,"sensors, actuators, interface, control, i/o"
Embedded Systems,Embedded System Security,"security, trust, cryptography, protection, tamper"
Embedded Systems,IoT and Wireless Communication,"iot, wireless, communication, network, connectivity"
Embedded Systems,Embedded System Verification,"verification, testing, debugging, model, validation"
Autonomous Systems,Safe Autonomous Systems,"safety, verification, validation, resilience, certification"
Autonomous Systems,AI for Autonomous Control,"deep, learning, reinforcement, neural, decision"
Autonomous Systems,Perception and Localization,"sensor, fusion, localization, mapping, estimation"
Autonomous Systems,Robot Locomotion and Dynamics,"bipedal, legged, locomotion, kinematics, dynamics"
Autonomous Systems,Multi-Agent Systems,"multi-agent, swarm, coordination, decentralized, communication"
Autonomous Systems,Human-Robot Interaction,"human, interaction, collaboration, trust, interface"
Control Systems,Linear Control System Stability,"linear, system, lmi, lyapunov, stability"
Control Systems,Model Predictive Control,"model, predictive, optimization, constraint, horizon"
Control Systems,Advanced Nonlinear Control,"nonlinear, robust, feedback, backstepping, adaptive"
Control Systems,Fault Detection and Diagnosis,"fault, detection, isolation, diagnosis, tolerance"
Control Systems,Autonomous Systems Control,"autonomous, systems, robotics, coordination, path"
Control Systems,Embedded Control System,"embedded, real-time, microcontroller, hardware, software"
Control Systems,AI in Control Systems,"artificial, learning, neural, fuzzy, data-driven"
Embedded Systems,Real-Time Operating Systems,"rtos, scheduling, real-time, os, priority"
Embedded Systems,Microcontroller Programming & Hardware,"microcontroller, peripheral, programming, assembly, hardware"
Embedded Systems,IoT Sensor Integration,"iot, sensors, connectivity, gateway, cloud"
Embedded Systems,FPGA and ASIC Design,"fpga, vhdl, verilog, logic, asic"
Embedded Systems,Energy-Efficient Embedded Design,"low-power, energy, management, battery, optimization"
Embedded Systems,Embedded System Security,"security, firmware, cryptography, tamper, trustzone"
Embedded Systems,Embedded Communication Protocols,"communication, protocol, spi, i2c, uart"
Robotics and Automation,Robot Motion and Control,"manipulator, kinematics, dynamics, trajectory, control"
Robotics and Automation,Robot Perception and Navigation,"sensor, perception, mapping, localization, navigation"
Robotics and Automation,Robotic Grasping and Manipulation,"gripping, force, tactile, dexterity, end-effector"
Robotics and Automation,Humanoid Robot Locomotion,"humanoid, bipedal, gait, balance, walking"
Robotics and Automation,Multi-Robot Systems and Swarms,"swarm, multi-robot, cooperation, communication, formation"
Robotics and Automation,Robot Learning and Adaptation,"machine, learning, reinforcement, imitation, adaptive"
Robotics and Automation,Industrial Robotics and Manufacturing,"industrial, manufacturing, assembly, welding, inspection"
Architecture and Urban Design,Sustainable Building Performance,"sustainable, energy, efficiency, green, performance"
Architecture and Urban Design,Public Space Urbanism,"public, space, urban, design, placemaking"
Architecture and Urban Design,Historic Preservation & Conservation,"historical, preservation, heritage, conservation, adaptive"
Architecture and Urban Design,Smart City Technology,"smart, city, technology, data, infrastructure"
Architecture and Urban Design,Residential Planning & Housing,"housing, density, affordability, community, residential"
Architecture and Urban Design,Parametric Design & Fabrication,"parametric, form, digital, fabrication, geometry"
Architecture and Urban Design,Climate Resilience and Planning,"resilience, climate, adaptation, disaster, vulnerability"
Sustainable Construction Materials and Techniques,Recycled Aggregate Concrete,"recycled, waste, aggregate, concrete, circular"
Sustainable Construction Materials and Techniques,Geopolymer Cementitious Binders,"geopolymer, cement, binder, alkali, activation"
Sustainable Construction Materials and Techniques,Bio-Based Building Materials,"bamboo, timber, bio-based, natural, renewable"
Sustainable Construction Materials and Techniques,Embodied Carbon Assessment,"life, cycle, assessment, embodied, carbon"
Sustainable Construction Materials and Techniques,Thermal Insulation Optimization,"thermal, insulation, energy, efficiency, envelope"
Sustainable Construction Materials and Techniques,3D Printed Construction Materials,"additive, manufacturing, 3d, printing, construction"
"Urban Planning, Waterfronts, and Public Spaces",Waterfront Gentrification and Equity,"gentrification, displacement, equity, social, revitalization"
"Urban Planning, Waterfronts, and Public Spaces",Public Space Design and Access,"access, usability, design, inclusivity, experience"
"Urban Planning, Waterfronts, and Public Spaces",Climate Resilience in Waterfronts,"climate, sea, flood, resilience, adaptation"
"Urban Planning, Waterfronts, and Public Spaces",Waterfront Ecological Restoration,"ecology, habitat, biodiversity, restoration, sustainability"
"Urban Planning, Waterfronts, and Public Spaces",Urban Mobility and Connectivity,"transportation, mobility, connectivity, transit, infrastructure"
"Urban Planning, Waterfronts, and Public Spaces",Public Space Community Governance,"community, participation, engagement, governance, stakeholder"
"Urban Planning, Waterfronts, and Public Spaces",Post-Industrial Waterfront Redevelopment,"historic, heritage, preservation, industrial, post-industrial"
"Cardiovascular & Metabolic Disorders (Atherosclerosis, MI, Diabetes, Hypercholesterolemia)",Atherosclerotic Plaque Development,"atherosclerosis, plaque, inflammation, vessel, lipids"
Retinoid Metabolism & Vitamin A Biochemistry,Retinoic Acid Signaling,"rar, rxr, receptor, gene, transcription"
Retinoid Metabolism & Vitamin A Biochemistry,Retinoic Acid Catabolism,"cyp26, catabolism, oxidation, degradation, inactivation"
Medicinal Chemistry / Drug Design,Drug Target Mechanisms,"target, molecular, mechanism, binding, receptors"
Medicinal Chemistry / Drug Design,Structure-Activity Relationship Design,"design, structure, optimization, lead, activity"
Medicinal Chemistry / Drug Design,Computer-Aided Drug Design,"docking, modeling, virtual, cadd, chemoinformatics"
Medicinal Chemistry / Drug Design,Natural Products Drug Discovery,"natural, products, discovery, biosynthesis, extracts"
Medicinal Chemistry / Drug Design,Drug ADMET Properties,"absorption, metabolism, pharmacology, toxicology, efficacy"
Medicinal Chemistry / Drug Design,Drug Delivery Systems,"formulation, delivery, nanoparticles, targeting, controlled"
Anticancer Drug Discovery,Molecular Mechanism and Targeting,"molecular, target, mechanism, inhibition, pathway"
Anticancer Drug Discovery,High-Throughput Drug Screening,"screening, high-throughput, compound, library, assay"
Anticancer Drug Discovery,Natural Product Drug Discovery,"natural, product, alkaloids, flavonoids, plant"
Anticancer Drug Discovery,Overcoming Chemoresistance in Cancer,"chemotherapy, resistance, overcoming, multidrug, sensitization"
Anticancer Drug Discovery,Computational Drug Design (CADD),"drug, design, computational, cadd, modeling"
Anticancer Drug Discovery,Cancer Immunotherapy Development,"immunotherapy, checkpoint, car-t, t-cell, cancer"
Anticancer Drug Discovery,Clinical Trials and Efficacy,"clinical, trial, phase, toxicity, efficacy"
Anti-inflammatory and Analgesic Drug Development,Anti-inflammatory Target Identification,"inflammation, cytokines, inhibitors, cox-2, targets"
Anti-inflammatory and Analgesic Drug Development,NSAID Hybrid Drug Design,"nsaid, gastrotoxicity, prodrug, hybrid, molecular"
Anti-inflammatory and Analgesic Drug Development,Drug Candidate Screening,"assay, screening, activity, vivo, vitro"
Anti-inflammatory and Analgesic Drug Development,Pharmacokinetic Profiling,"pharmacokinetics, absorption, metabolism, excretion, distribution"
Anti-inflammatory and Analgesic Drug Development,Drug Safety and Toxicology,"toxin, safety, adverse, risk, preclinical"
Anti-inflammatory and Analgesic Drug Development,Natural Compound Drug Discovery,"natural, extracts, compounds, medicinal, herbal"
Pharmacogenomics,Genetic Drug Response Variation,"genes, response, drug, metabolism, variant"
Pharmacogenomics,CYP450 Metabolism and Drug Fate,"cyp450, enzyme, pharmacokinetics, efficacy, toxicity"
Pharmacogenomics,Pharmacogenetic Biomarker Identification,"biomarker, adverse, reaction, genotyping, allele"
Pharmacogenomics,Pharmacogenomics in Cancer Treatment,"oncology, cancer, chemotherapy, personalized, treatment"
Pharmacogenomics,Genome-Wide Association Studies,"gwas, association, phenotype, population, study"
Pharmacogenomics,Psychiatric Drug Pharmacogenomics,"antidepressant, psychiatry, mental, health, efficacy"
MicroRNA Biomarkers & Molecular Diagnostics,miRNA Diagnostics and Detection,"microrna, biomarker, diagnosis, disease, detection"
MicroRNA Biomarkers & Molecular Diagnostics,Circulating miRNA Isolation & Analysis,"circulating, plasma, serum, noncoding, exosomes"
MicroRNA Biomarkers & Molecular Diagnostics,miRNA Molecular Assay Development,"molecular, assay, pcr, sequencing, quantification"
MicroRNA Biomarkers & Molecular Diagnostics,Oncology/Cancer,"cancer, oncology, prognosis, metastasis, therapeutic"
MicroRNA Biomarkers & Molecular Diagnostics,miRNA Expression Profiling,"profiling, signature, expression, regulation, target"
MicroRNA Biomarkers & Molecular Diagnostics,Clinical Biomarker Validation,"validation, clinical, sensitivity, specificity, predictive"
Clinical Pharmacology & Drug Response in Chronic Diseases,Drug Pharmacokinetics in Chronic Disease,"pharmacokinetics, absorption, distribution, metabolism, elimination"
Clinical Pharmacology & Drug Response in Chronic Diseases,Pharmacogenomics of Drug Response,"pharmacogenomics, genotype, phenotype, polymorphism, individualization"
Clinical Pharmacology & Drug Response in Chronic Diseases,Drug Safety and Adverse Events,"drug, adverse, events, safety, monitoring"
Clinical Pharmacology & Drug Response in Chronic Diseases,Medication Adherence and Patient Outcomes,"adherence, compliance, efficacy, patient, outcomes"
Clinical Pharmacology & Drug Response in Chronic Diseases,Polypharmacy in Multiple Chronic Conditions,"multiple, morbidity, polypharmacy, interactions, management"
Clinical Pharmacology & Drug Response in Chronic Diseases,Biomarker-Guided Drug Optimization,"biomarkers, therapeutic, monitoring, dosage, optimization"
Clinical Pharmacology & Drug Response in Chronic Diseases,Pharmacology in Specific Chronic Diseases,"cardiovascular, diabetes, copd, alzheimer's, inflammation"
Pharmacovigilance & Drug Safety Monitoring,Adverse Event Reporting,"adverse, event, reaction, monitoring, safety"
Pharmacovigilance & Drug Safety Monitoring,Drug Safety Signal Detection,"signal, detection, mining, data, disproportionality"
Pharmacovigilance & Drug Safety Monitoring,Individual Case Safety Reports,"icsr, case, report, management, individual"
Pharmacovigilance & Drug Safety Monitoring,Risk Management & Evaluation,"risk, management, plan, minimisation, evaluation"
Pharmacovigilance & Drug Safety Monitoring,Drug Causality Assessment,"causality, assessment, pharmacology, algorithm, relationship"
Pharmacovigilance & Drug Safety Monitoring,Regulatory Compliance & Policy,"regulatory, compliance, policy, guidelines, inspection"
Pharmacovigilance & Drug Safety Monitoring,Pharmacoepidemiology Studies,"pharmacoepidemiology, studies, database, population, post-marketing"
Oncology Pharmacogenetics & Drug Toxicity,Drug Metabolism Genetics,"cytochrome, metabolism, enzyme, genotype, phenotype"
Oncology Pharmacogenetics & Drug Toxicity,Chemotherapy Toxicity Risk,"toxicity, adverse, reaction, germline, risk"
Oncology Pharmacogenetics & Drug Toxicity,Predictive Biomarkers for Therapy,"biomarker, response, therapy, targeted, efficacy"
Oncology Pharmacogenetics & Drug Toxicity,Somatic Mutations in Cancer,"mutation, somatic, tumor, resistance, cancer"
Oncology Pharmacogenetics & Drug Toxicity,Single Nucleotide Polymorphisms,"polymorphism, snp, alleles, variant, dna"
Oncology Pharmacogenetics & Drug Toxicity,Individualized Cancer Dosing,"dosing, individualized, precision, algorithm, treatment"
Analytical Chemistry & Separation Science,Advanced Chromatographic Techniques,"chromatography, liquid, gas, separation, detector"
Analytical Chemistry & Separation Science,Mass Spectrometry Analysis,"mass, spectrometry, ionization, fragmentation, quantification"
Analytical Chemistry & Separation Science,Sample Preparation Methods,"sample, preparation, extraction, cleanup, matrix"
Analytical Chemistry & Separation Science,Electrochemical Sensing,"electrochemistry, voltammetry, sensor, potential, current"
Analytical Chemistry & Separation Science,Molecular Spectroscopy,"spectroscopy, absorption, emission, fluorescence, detection"
